﻿id,authors,title,year,source,publisher,articleurl,citesurl,abstract,fulltexturl,relatedurl,String Search,v1_decision,v1_reason,v2_decision,v2_reason
14,"Là Yang, C Wei, J Yang, W Xia, Y Yang",Fuzzcode: Code large language model-based fuzz testing for industrial iot programs,2025,IEEE Internet of ,ieeexplore.ieee.org,https://ieeexplore.ieee.org/abstract/document/11028927/,"https://scholar.google.com/scholar?cites=8104462651931100859&as_sdt=2005&sciodt=0,5&hl=en"," Moreover, we fine-tune the LLM on the proposed instruction  instances that yield new code coverage or trigger crashes.  FuzzCoder significantly improves code coverage and the num",,"https://scholar.google.com/scholar?q=related:uwbGt9fVeHAJ:scholar.google.com/&scioq=%22large+language+model%22%7Cllm%7C%22gpt+4%22+%22unit+test%22%7C%22test+case%22+%22branch+coverage%22%7C%22code+coverage%22%7C%22mutation+score%22%7C%22mutation+testing%22&hl=en&as_sdt=0,5&as_ylo=2025&as_yhi=2026",String B,EXCLUDE,IC-P: Bi bo tập trung vào fuzz testing (t?o input d? tìm crash và tang code coverage) thay và sinh tự động unit test (Java/Python).,,
15,"J Zhang, D Ghobari, Mà Sabetzadeh",Simulink mutation testing using codebert,2025,2025 IEEE/ACM ,ieeexplore.ieee.org,https://ieeexplore.ieee.org/abstract/document/11081722/,"https://scholar.google.com/scholar?cites=9187927319297301920&as_sdt=2005&sciodt=0,5&hl=en"," BERTiMuS employs CodeBERT, an LLM specialized in interpreting and  that test case, and requirements-aware mutation testing, where a mutant is killed by a test case if the test case ",https://arxiv.org/pdf/2501.07553,"https://scholar.google.com/scholar?q=related:oJ3SmDcTgn8J:scholar.google.com/&scioq=%22large+language+model%22%7Cllm%7C%22gpt+4%22+%22unit+test%22%7C%22test+case%22+%22branch+coverage%22%7C%22code+coverage%22%7C%22mutation+score%22%7C%22mutation+testing%22&hl=en&as_sdt=0,5&as_ylo=2025&as_yhi=2026",String B,EXCLUDE,"IC-P: Bi bo tập trung vào mutation testing cho Simulink, không phải sinh unit test tự động. IC-I: Sử dụng CodeBERT, không phải GPT-4.",,
16,"R Lin, R Wang, G Hu, X Xu",LMFuzz: Program repair fuzzing based on large language models,2026,Automated Software Engineering,Springer,https://link.springer.com/article/10.1007/s10515-025-00568-8,"https://scholar.google.com/scholar?cites=16706984066078411801&as_sdt=2005&sciodt=0,5&hl=en"," for fuzz testing, both code coverage and validity must be  20% lower code coverage compared to the LLM-based fuzzer  UTopia leverages data mutation based on existing unit test files ",,"https://scholar.google.com/scholar?q=related:GQy3nn0h2-cJ:scholar.google.com/&scioq=%22large+language+model%22%7Cllm%7C%22gpt+4%22+%22unit+test%22%7C%22test+case%22+%22branch+coverage%22%7C%22code+coverage%22%7C%22mutation+score%22%7C%22mutation+testing%22&hl=en&as_sdt=0,5&as_ylo=2025&as_yhi=2026",String B,EXCLUDE,"IC-P: Bi bo tập trung vào fuzzing và sửa lỗi chương trình (program repair), không phải sinh tự động unit test. N?i dung không dp ?ng tr?ng tìm c?t li là t?o unit test.",,
17,"Q Zhang, R Kang, Y Liu, X Cao",Large Language Model-Enhanced Test Case Generation,2025,2025 4th International ,ieeexplore.ieee.org,https://ieeexplore.ieee.org/abstract/document/11335495/,," quality, with test case generation being a core yet labor- approaches and proposes an improved LLM-based method that  evaluate the method in terms of code coverage, pass rate, and ",,"https://scholar.google.com/scholar?q=related:ojeuEPavnnUJ:scholar.google.com/&scioq=%22large+language+model%22%7Cllm%7C%22gpt+4%22+%22unit+test%22%7C%22test+case%22+%22branch+coverage%22%7C%22code+coverage%22%7C%22mutation+score%22%7C%22mutation+testing%22&hl=en&as_sdt=0,5&as_ylo=2025&as_yhi=2026",String B,UNSURE,"Không c full-text để xác minh IC-E (số liệu cụ thể và? branch coverage/mutation score), IC-I (sử dụng GPT-4), và s? trang (EC-S). Venue không r đầy đủ, không th? dnh gi uy tn (IC-T).",Include,"Đọc full-text, xác nhận đủ IC"
18,"JV Kachirackal, Và Balakrishnan",NLP-Powered Test Case Generation from Function DescriptionA Cross-Language Approach,2025,2025 3rd International ,ieeexplore.ieee.org,https://ieeexplore.ieee.org/abstract/document/11412018/,," Traditional test case generation methods are limited by  reinforcement learning and mutation testing techniques, ensuring  with tokenizer pipelines and downstream LLM processing. ",,"https://scholar.google.com/scholar?q=related:eok8MAZJ1S4J:scholar.google.com/&scioq=%22large+language+model%22%7Cllm%7C%22gpt+4%22+%22unit+test%22%7C%22test+case%22+%22branch+coverage%22%7C%22code+coverage%22%7C%22mutation+score%22%7C%22mutation+testing%22&hl=en&as_sdt=0,5&as_ylo=2025&as_yhi=2026",String B,EXCLUDE,"EC-S: Page count là 0, không d? 4 trang, c th? là extended abstract ho?c poster.",,
19,"WC Oudraogo, Y Li, X Đang, X Zhou",Rethinking Cognitive Complexity for Unit Tests: Toward a Readability-Aware Metric Grounded in Developer Perception,2025,2025 IEEE ,ieeexplore.ieee.org,https://ieeexplore.ieee.org/abstract/document/11186057/,"https://scholar.google.com/scholar?cites=5951471495026324954&as_sdt=2005&sciodt=0,5&hl=en"," Large Language Model (LLM)-based approaches [2], [3], [4], [5], [6], [7], [8], enabling scalable unit test  -dimensional model that incorporates code coverage and fault-detection ability to ",https://arxiv.org/pdf/2506.06764,"https://scholar.google.com/scholar?q=related:2jXo38rfl1IJ:scholar.google.com/&scioq=%22large+language+model%22%7Cllm%7C%22gpt+4%22+%22unit+test%22%7C%22test+case%22+%22branch+coverage%22%7C%22code+coverage%22%7C%22mutation+score%22%7C%22mutation+testing%22&hl=en&as_sdt=0,5&as_ylo=2025&as_yhi=2026",String B,EXCLUDE,"IC-P: Bi bo tập trung vào đề xuất metric dnh gi độ phức tạp của mà kiểm thử, không phải sinh tự động unit test.",,
20,"D Italiano, C Cummins",Finding missed code size optimizations in compilers using large language models,2025,Proceedings of the 34th ACM SIGPLAN ,dl.acm.org,https://dl.acm.org/doi/abs/10.1145/3708493.3712686,"https://scholar.google.com/scholar?cites=12644704441073603186&as_sdt=2005&sciodt=0,5&hl=en"," 2.4 Detecting Duplicates As in all undirected test case generators for compilers, our  adopt a process of mutation testing, but starting from a trivial seed program, and using an LLM as the ",https://dl.acm.org/doi/pdf/10.1145/3708493.3712686,"https://scholar.google.com/scholar?q=related:chL_07EDe68J:scholar.google.com/&scioq=%22large+language+model%22%7Cllm%7C%22gpt+4%22+%22unit+test%22%7C%22test+case%22+%22branch+coverage%22%7C%22code+coverage%22%7C%22mutation+score%22%7C%22mutation+testing%22&hl=en&as_sdt=0,5&as_ylo=2025&as_yhi=2026",String B,EXCLUDE,EC-A: Không truy c?p được full-text và abstract thiếu số liệu coverage,,
21,G Wimalagunasekara,"LLM-Based Unit Test Cases Generation for React, Vue, and Angular Components",2026,2026 6th International ,ieeexplore.ieee.org,https://ieeexplore.ieee.org/abstract/document/11453759/,," Related research on LLM-based test generation for JavaScript remains limited and  rate and 98.01% statement coverage using JEST and mutation testing with Stryker. Their test tasks, ",,"https://scholar.google.com/scholar?q=related:uOBBt1z2tr4J:scholar.google.com/&scioq=%22large+language+model%22%7Cllm%7C%22gpt+4%22+%22unit+test%22%7C%22test+case%22+%22branch+coverage%22%7C%22code+coverage%22%7C%22mutation+score%22%7C%22mutation+testing%22&hl=en&as_sdt=0,5&as_ylo=2025&as_yhi=2026",String B,EXCLUDE,"IC-P: Bi bo tập trung sinh unit test cho React, Vue, Angular (JavaScript), không phải Java/Python như yêu cầu.",,
22,"K Liu, C Tan","Llm-Fuzz: Adaptive, Structure-Aware Fuzzing of Javascript Engines with Large Language Models",2025, 11th International Conference on Computer and ,ieeexplore.ieee.org,https://ieeexplore.ieee.org/abstract/document/11438113/,," Our evaluation demonstrates that this adaptive, LLM-guided improves code coverage  LLM-generated mutation; when a mutation results in a test case that discovers new code coverage",,"https://scholar.google.com/scholar?q=related:2ZoL9STfvUAJ:scholar.google.com/&scioq=%22large+language+model%22%7Cllm%7C%22gpt+4%22+%22unit+test%22%7C%22test+case%22+%22branch+coverage%22%7C%22code+coverage%22%7C%22mutation+score%22%7C%22mutation+testing%22&hl=en&as_sdt=0,5&as_ylo=2025&as_yhi=2026",String B,EXCLUDE,"IC-P: Bi bo tập trung vào fuzzing JavaScript engines, không phải sinh unit test tự động cho Java/Python.",,
23,"F Zhong, Mà Huang, X Li, Y Nie",A Survey of Configuration Testing Technologys,2025,2025 IEEE 10th International ,ieeexplore.ieee.org,https://ieeexplore.ieee.org/abstract/document/11360471/,," rely on manual or semiautomatic test case generation, which is  testing technology based on large language model. This paper  may be very effective in achieving high code coverage. ",,"https://scholar.google.com/scholar?q=related:fcK3yt9YwckJ:scholar.google.com/&scioq=%22large+language+model%22%7Cllm%7C%22gpt+4%22+%22unit+test%22%7C%22test+case%22+%22branch+coverage%22%7C%22code+coverage%22%7C%22mutation+score%22%7C%22mutation+testing%22&hl=en&as_sdt=0,5&as_ylo=2025&as_yhi=2026",String B,EXCLUDE,"IC-P: Tr?ng tìm là kiểm thử c?u hnh (configuration testing), không phải sinh unit test tự động. EC-O: Sai ch? d? task. EC-N: Bi kh?o st không c thực nghiệm.",,
24,"R Karanjai, Là Xu, W Shi",HPCAgentTester: A Multi-Agent LLM Approach for Enhanced HPC Unit Test Generation,2025,2025 2nd IEEE/ACM International ,ieeexplore.ieee.org,https://ieeexplore.ieee.org/abstract/document/11334271/,," Code Coverage defined as line and branch coverage measured using gcov/lcov. While useful, we acknowledge that high coverage does not guarantee detection of parallel bugs. 2) ",https://arxiv.org/pdf/2511.10860,"https://scholar.google.com/scholar?q=related:8lqw_27BUGAJ:scholar.google.com/&scioq=%22large+language+model%22%7Cllm%7C%22gpt+4%22+%22unit+test%22%7C%22test+case%22+%22branch+coverage%22%7C%22code+coverage%22%7C%22mutation+score%22%7C%22mutation+testing%22&hl=en&as_sdt=0,5&as_ylo=2025&as_yhi=2026",String B,EXCLUDE,IC-I: Không c bằng chứng sử dụng GPT-4 ho?c GPT-4o; bi bo ch? đề cập chung chung 'LLM' mà không ch? r mà hnh cụ thể.,,
25,"Y Xie, Z Xu, Y Tian, Mà Zhou, X Zhou",Kitten: A simple yet effective baseline for evaluating llm-based compiler testing techniques,2025,Proceedings of the 34th ,dl.acm.org,https://dl.acm.org/doi/abs/10.1145/3713081.3731731,"https://scholar.google.com/scholar?cites=15559645657803254372&as_sdt=2005&sciodt=0,5&hl=en", Kitten shares great similarities with LLM-based approaches. Both aim to find crashes and  LLM inference. Our experiments show that Kitten outperforms Fuzz4All in both code coverage ,https://dl.acm.org/doi/pdf/10.1145/3713081.3731731,"https://scholar.google.com/scholar?q=related:ZOpPiEn37tcJ:scholar.google.com/&scioq=%22large+language+model%22%7Cllm%7C%22gpt+4%22+%22unit+test%22%7C%22test+case%22+%22branch+coverage%22%7C%22code+coverage%22%7C%22mutation+score%22%7C%22mutation+testing%22&hl=en&as_sdt=0,5&as_ylo=2025&as_yhi=2026",String B,EXCLUDE,"EC-O: Bi bo tập trung vào kiểm thử trnh bin đặch (compiler testing), không phải sinh unit test tự động cho Java/Python.",,
26,"X Wang, Z Ji, Y Wang, Mà Liu",A Multi-Stage Approach for LLM-Based Automated Repair of Test Cases,2026,2026 8th International ,ieeexplore.ieee.org,https://ieeexplore.ieee.org/abstract/document/11527996/,," improves test case correctness by 14.32%, compilation rate by 16.88%, line coverage by 12.90%, and branch coverage by 12.46%. The method effectively enhances the quality of LLM-",,"https://scholar.google.com/scholar?q=related:IscCYQy4rhcJ:scholar.google.com/&scioq=%22large+language+model%22%7Cllm%7C%22gpt+4%22+%22unit+test%22%7C%22test+case%22+%22branch+coverage%22%7C%22code+coverage%22%7C%22mutation+score%22%7C%22mutation+testing%22&hl=en&as_sdt=0,5&as_ylo=2025&as_yhi=2026",String B,EXCLUDE,"EC-O: Bi bo tập trung vào sửa ch?a (repair) test case, không phải sinh tự động unit test; IC-P: Tr?ng tìm không phải là sinh Unit Test tự động.",,
27,"R Dong, F Tong, H Huang, X Zhu, X Xiao",One Mutation Fits All: Exploring Universal Library Fuzzing based on Exogenous Mutation,2025, on Dependable and ,ieeexplore.ieee.org,https://ieeexplore.ieee.org/abstract/document/11079961/,"https://scholar.google.com/scholar?cites=7864195098121626975&as_sdt=2005&sciodt=0,5&hl=en"," Our results show significant improvements in code coverage  format, coupled with our LLMbased conversion approach,  raw execution speed for effective test case generation. While ",,"https://scholar.google.com/scholar?q=related:X2Xog8Y7I20J:scholar.google.com/&scioq=%22large+language+model%22%7Cllm%7C%22gpt+4%22+%22unit+test%22%7C%22test+case%22+%22branch+coverage%22%7C%22code+coverage%22%7C%22mutation+score%22%7C%22mutation+testing%22&hl=en&as_sdt=0,5&as_ylo=2025&as_yhi=2026",String B,EXCLUDE,"EC-O: Bi bo tập trung vào fuzzing thu vi?n, không phải sinh unit test tự động.",,
28,"S Zarebski, K Rusek, P Cholda",Regression test optimization for software of the cellular network base stations: a language-based approach,2026,Expert Systems with Applications,Elsevier,https://www.sciencedirect.com/science/article/pii/S0957417426001399,"https://scholar.google.com/scholar?cites=3849176524336303575&as_sdt=2005&sciodt=0,5&hl=en","This paper introduces Linear Model of Latent Dirichlet Allocation (LMLDA), a novel methodology for software test optimization that directly addresses the gap between computationally-",https://papers.ssrn.com/sol3/Delivery.cfm?abstractid=5428185,"https://scholar.google.com/scholar?q=related:143WsqcFazUJ:scholar.google.com/&scioq=%22large+language+model%22%7Cllm%7C%22gpt+4%22+%22unit+test%22%7C%22test+case%22+%22branch+coverage%22%7C%22code+coverage%22%7C%22mutation+score%22%7C%22mutation+testing%22&hl=en&as_sdt=0,5&as_ylo=2025&as_yhi=2026",String B,EXCLUDE,EC-A: Không truy c?p được full-text và abstract thiếu số liệu coverage,,
29,"S Zhou, T Li, K Wang, Y Huang, Là Shi",Understanding the effectiveness of coverage criteria for large language models: A special angle from jailbreak attacks,2025,2025 IEEE/ACM 47th ,ieeexplore.ieee.org,https://ieeexplore.ieee.org/abstract/document/11029795/,"https://scholar.google.com/scholar?cites=15858931815758362520&as_sdt=2005&sciodt=0,5&hl=en"," security capabilities for LLM-integrated systems. Additionally, we propose test case prioritization to  Mirroring the design of code coverage based on program logic, a series of studies ",https://arxiv.org/pdf/2408.15207,"https://scholar.google.com/scholar?q=related:mPdqU3Y-FtwJ:scholar.google.com/&scioq=%22large+language+model%22%7Cllm%7C%22gpt+4%22+%22unit+test%22%7C%22test+case%22+%22branch+coverage%22%7C%22code+coverage%22%7C%22mutation+score%22%7C%22mutation+testing%22&hl=en&as_sdt=0,5&as_ylo=2025&as_yhi=2026",String B,EXCLUDE,"IC-P: Bi bo tập trung vào kiểm thử mà hnh ngn ng? là?n (LLM) tru?c t?n cng jailbreak, không lin quan đến sinh Unit Test tự động cho Java/Python.",,
30,"Mà Barboni, F Lampa, A Morichetta",Alchemist: LLM-driven test generation using solidity mutants and the scientific method,2025, on Blockchain and ,ieeexplore.ieee.org,https://ieeexplore.ieee.org/abstract/document/11114643/,"https://scholar.google.com/scholar?cites=16294505606177129547&as_sdt=2005&sciodt=0,5&hl=en"," the LLM generates a corresponding test case t. To perform this task, we provide to the LLM:  This work bridges LLM-driven test generation and mutation testing to automatically enhance ",,"https://scholar.google.com/scholar?q=related:S4TMToS2IeIJ:scholar.google.com/&scioq=%22large+language+model%22%7Cllm%7C%22gpt+4%22+%22unit+test%22%7C%22test+case%22+%22branch+coverage%22%7C%22code+coverage%22%7C%22mutation+score%22%7C%22mutation+testing%22&hl=en&as_sdt=0,5&as_ylo=2025&as_yhi=2026",String B,EXCLUDE,"IC-P: Bi bo tập trung sinh unit test cho Solidity (blockchain), không phải Java/Python như yêu cầu.",,
31,"X Hu, F Niu, J Chen, X Zhou, J Zhang, J He",Assessing and advancing benchmarks for evaluating large language models in software engineering tasks,2025,ACM Transactions on ,dl.acm.org,https://dl.acm.org/doi/abs/10.1145/3786771,"https://scholar.google.com/scholar?cites=6541659667582222612&as_sdt=2005&sciodt=0,5&hl=en", We have identified key challenges associated with LLM  challenges and opportunities of LLM benchmarks in the field of  test cases with high code coverage or strong bug detection ,https://dl.acm.org/doi/pdf/10.1145/3786771,"https://scholar.google.com/scholar?q=related:FAG9986kyFoJ:scholar.google.com/&scioq=%22large+language+model%22%7Cllm%7C%22gpt+4%22+%22unit+test%22%7C%22test+case%22+%22branch+coverage%22%7C%22code+coverage%22%7C%22mutation+score%22%7C%22mutation+testing%22&hl=en&as_sdt=0,5&as_ylo=2025&as_yhi=2026",String B,EXCLUDE,"IC-P: Bi bo tập trung vào dnh gi và c?i ti?n benchmark cho LLM trong các tc và? cng ngh? phần mà?mà ni chung, không c tr?ng tìm c?t li là sinh Unit Test tự động.",,
32,"S Patel, A Yadavally, H Dhulipala",Planning a large language model for static detection of runtime errors in code snippets,2025,2025 IEEE/ACM 47th ,ieeexplore.ieee.org,https://ieeexplore.ieee.org/abstract/document/11029953/,"https://scholar.google.com/scholar?cites=12007959044958849442&as_sdt=2005&sciodt=0,5&hl=en"," /failing test cases, while ORCA works only on one test case and for incomplete code.  Yadavally, and TN Nguyen, Planning to guide llm for code coverage prediction, in Proceedings of ",,"https://scholar.google.com/scholar?q=related:ogk2aCHXpKYJ:scholar.google.com/&scioq=%22large+language+model%22%7Cllm%7C%22gpt+4%22+%22unit+test%22%7C%22test+case%22+%22branch+coverage%22%7C%22code+coverage%22%7C%22mutation+score%22%7C%22mutation+testing%22&hl=en&as_sdt=0,5&as_ylo=2025&as_yhi=2026",String B,EXCLUDE,"IC-P, EC-O: Bi bo tập trung vào pht hi?n lỗi runtime tinh (static detection of runtime errors), không phải sinh unit test tự động.",,
33,"Mà Yan, J Chen, T Jiang, J Jiang",Evaluating Spectrum-Based Fault Localization on Deep Learning Libraries,2025,IEEE Transactions on ,ieeexplore.ieee.org,https://ieeexplore.ieee.org/abstract/document/10930847/,"https://scholar.google.com/scholar?cites=13097586511829065482&as_sdt=2005&sciodt=0,5&hl=en"," the LLM to generate a potential passing test case based on the original failing test case and  , we compared the code coverage of the test cases generated by each technique with the ",,"https://scholar.google.com/scholar?q=related:Ct-E3In5w7UJ:scholar.google.com/&scioq=%22large+language+model%22%7Cllm%7C%22gpt+4%22+%22unit+test%22%7C%22test+case%22+%22branch+coverage%22%7C%22code+coverage%22%7C%22mutation+score%22%7C%22mutation+testing%22&hl=en&as_sdt=0,5&as_ylo=2025&as_yhi=2026",String B,EXCLUDE,"IC-P, EC-O: Bi bo tập trung vào fault localization (định vị lỗi) cho thu vi?n deep learning, không phải sinh tự động unit test. Việc sinh test case ch? là phương tiện hỗ trợ, không phải tr?ng tìm c?t li.",,
34,"B Yang, S Li, J Li, K Du, H Yu, J Sun",Enhancing Test Case Generation for Fuzzing Deep Learning Libraries Using Few-Shot Learning,2025,2025 IEEE 10th ,ieeexplore.ieee.org,https://ieeexplore.ieee.org/abstract/document/11360415/,," In this work, we utilize an LLM-based test case generation method  By iteratively refining our test case requirements through  can effectively increase the code coverage of the software to ",,"https://scholar.google.com/scholar?q=related:4WO_VWGeIRcJ:scholar.google.com/&scioq=%22large+language+model%22%7Cllm%7C%22gpt+4%22+%22unit+test%22%7C%22test+case%22+%22branch+coverage%22%7C%22code+coverage%22%7C%22mutation+score%22%7C%22mutation+testing%22&hl=en&as_sdt=0,5&as_ylo=2025&as_yhi=2026",String B,EXCLUDE,"EC-O: Bi bo tập trung vào sinh test case cho fuzzing thu vi?n deep learning, không phải sinh Unit Test tự động cho Java/Python. Ngoi ra không c thông tin và? GPT-4 (IC-I) và số liệu coverage cụ thể (IC-E).",,
35,"X Li, J Chen, Mà Yan, D Wang, X Fan",FLAME: Enhancing Functional Coverage in Processor Verification via Large Language Models,2026, on Computer-Aided ,ieeexplore.ieee.org,https://ieeexplore.ieee.org/abstract/document/11404211/,, just measure code execution paths like code coverage does [5]. Functional  the LLM will produce a test case that is explicitly tailored as an input for target functional points. This test case ,https://cdn.superpung.com/publications/TCAD-2026-FLAME-Paper.pdf,"https://scholar.google.com/scholar?q=related:m2AIzLaWzqYJ:scholar.google.com/&scioq=%22large+language+model%22%7Cllm%7C%22gpt+4%22+%22unit+test%22%7C%22test+case%22+%22branch+coverage%22%7C%22code+coverage%22%7C%22mutation+score%22%7C%22mutation+testing%22&hl=en&as_sdt=0,5&as_ylo=2025&as_yhi=2026",String B,EXCLUDE,"IC-P, EC-O: Bi bo tập trung vào kiểm thử ch?c nang b? x? là (processor functional verification), không phải sinh Unit Test tự động cho Java/Python. Không dp ?ng tiêu chí tr?ng tìm c?t li.",,
36,"X Chen, J Liu, Y Zhang, Q Hu, Y Han, R Zhang",TraceAwareness and dual-strategy fuzz testing: Enhancing path coverage and crash localization with stochastic science and large language models,2025,Computers and ,Elsevier,https://www.sciencedirect.com/science/article/pii/S0045790625002095,"https://scholar.google.com/scholar?cites=8290573721148451784&as_sdt=2005&sciodt=0,5&hl=en","This paper proposes an innovative fuzzing technique to address path coverage and crash localization challenges inherent in traditional methods. We introduce TraceAwareness, a ",,"https://scholar.google.com/scholar?q=related:yOs9wd8IDnMJ:scholar.google.com/&scioq=%22large+language+model%22%7Cllm%7C%22gpt+4%22+%22unit+test%22%7C%22test+case%22+%22branch+coverage%22%7C%22code+coverage%22%7C%22mutation+score%22%7C%22mutation+testing%22&hl=en&as_sdt=0,5&as_ylo=2025&as_yhi=2026",String B,EXCLUDE,"EC-O: Bi bo tập trung vào fuzzing và crash localization, không phải sinh unit test tự động (Java/Python).",,
37,"X Liu, J Lin, W Dong, Z Tang",Large Language Model-Assisted Security Testing for Embedded Systems,2025, Conference on Signal ,ieeexplore.ieee.org,https://ieeexplore.ieee.org/abstract/document/11406662/,," code coverage of firmware execution, this paper proposes a Large Language Model (LLM)- To further evaluate the effectiveness of LLM-assisted test case generation (RQ2), this paper ",,"https://scholar.google.com/scholar?q=related:HHSJc_zsqRwJ:scholar.google.com/&scioq=%22large+language+model%22%7Cllm%7C%22gpt+4%22+%22unit+test%22%7C%22test+case%22+%22branch+coverage%22%7C%22code+coverage%22%7C%22mutation+score%22%7C%22mutation+testing%22&hl=en&as_sdt=0,5&as_ylo=2025&as_yhi=2026",String B,EXCLUDE,"EC-O: Bi bo tập trung vào kiểm thử bảo mật cho hệ thống nhng, không phải sinh unit test tự động cho Java/Python.",,
38,"E Andrews, A Jayasena",Semantic-Guided Test Generation using Fine-Tuned LLMs for Validation of Hardware Accelerators,2026,2026 27th International ,ieeexplore.ieee.org,https://ieeexplore.ieee.org/abstract/document/11534681/,, how each newly generated test case contributes to exercising  Figure 5 contains a sample test case produced by SGTG with  the LLM learned that achieving high code coverage requires ,,"https://scholar.google.com/scholar?q=related:gXUwlRUu2kgJ:scholar.google.com/&scioq=%22large+language+model%22%7Cllm%7C%22gpt+4%22+%22unit+test%22%7C%22test+case%22+%22branch+coverage%22%7C%22code+coverage%22%7C%22mutation+score%22%7C%22mutation+testing%22&hl=en&as_sdt=0,5&as_ylo=2025&as_yhi=2026",String B,EXCLUDE,"IC-P, EC-O: Bi bo tập trung vào sinh test cho kiểm thử phần c?ng (hardware accelerators), không phải sinh Unit Test tự động cho Java/Python. Ngoi ra, không c thông tin và? việc sử dụng GPT-4 hay số liệu coverage cụ thể.",,
39,"B Qian, Y Gu, C Wu, Y Mu, X Sun",Fuzz Testing for Polymorphic Network Firmware: A Collaborative Optimization Framework of LLMs and Neural Networks,2025, of the ACM Conext-2025 Workshop ,dl.acm.org,https://dl.acm.org/doi/abs/10.1145/3769697.3771241,"https://scholar.google.com/scholar?cites=12229245587090256211&as_sdt=2005&sciodt=0,5&hl=en", show that combining LLM generation with neural scheduling raises code coverage from about 30 a mutated test case achieves strictly higher code coverage than its previous execution. ,https://dl.acm.org/doi/pdf/10.1145/3769697.3771241,"https://scholar.google.com/scholar?q=related:UzGHcRECt6kJ:scholar.google.com/&scioq=%22large+language+model%22%7Cllm%7C%22gpt+4%22+%22unit+test%22%7C%22test+case%22+%22branch+coverage%22%7C%22code+coverage%22%7C%22mutation+score%22%7C%22mutation+testing%22&hl=en&as_sdt=0,5&as_ylo=2025&as_yhi=2026",String B,EXCLUDE,"EC-O: Bi bo tập trung vào fuzz testing cho firmware mà?ng, không phải sinh unit test tự động cho Java/Python.",,
