﻿id,authors,title,year,source,publisher,articleurl,citesurl,abstract,fulltexturl,relatedurl,String Search,v1_decision,v1_reason,v2_decision,v2_reason
158,"N Bhatia, J Singh",Automated Test Case Generation from Unstructured Software Requirements Using Advanced NLP Techniques,2025,2025 12th International Conference on ,ieeexplore.ieee.org,https://ieeexplore.ieee.org/abstract/document/11241453/,," Python language plays the key role in execution of these tasks 100% efficiency because test case generation is a complex task We may use pre trained large language model like BERT, ",,"https://scholar.google.com/scholar?q=related:qWKZqD0kuZAJ:scholar.google.com/&scioq=%22large+language+model%22%7Cllm%7C%22gpt+4%22%7Cchatgpt+%22unit+test+generation%22%7C%22test+case+generation%22%7C%22automated+test+generation%22+java%7Cpython&hl=en&as_sdt=0,5&as_ylo=2025&as_yhi=2026",String A,EXCLUDE,"IC-P: Bi bo tập trung sinh test case t? yêu cầu phần mà?mà, không phải unit test tự động cho Java/Python. IC-I: Sử dụng BERT, không c GPT-4. IC-E: Không c số liệu Branch Coverage hay Mutation Score.",,
159,"R Ravi, D Bradshaw, S Ruberto",LLMLOOP: Improving LLM-Generated Code and Tests through Automated Iterative Feedback Loops,2025,2025 IEEE ,ieeexplore.ieee.org,https://ieeexplore.ieee.org/abstract/document/11185878/,"https://scholar.google.com/scholar?cites=1145641537529988879&as_sdt=2005&sciodt=0,5&hl=en"," We presented each of the 164 JAVA problems to the LLM using  language models for automated unit test generation, IEEE  Huang, Llm-powered test case generation for detecting ",https://valerio-terragni.github.io/assets/pdf/ravi-icsme-2025.pdf,"https://scholar.google.com/scholar?q=related:D0dolOgi5g8J:scholar.google.com/&scioq=%22large+language+model%22%7Cllm%7C%22gpt+4%22%7Cchatgpt+%22unit+test+generation%22%7C%22test+case+generation%22%7C%22automated+test+generation%22+java%7Cpython&hl=en&as_sdt=0,5&as_ylo=2025&as_yhi=2026",String A,EXCLUDE,"IC-I: Không c thông tin và? việc sử dụng GPT-4 ho?c GPT-4o trong bi bo; IC-P: Tr?ng tìm chnh là c?i thì?n code và test thông qua vng là?p phần h?i (program repair), không phải sinh unit test tự động.",,
160,"Z Ma, T Zhang, J Liu, W Zhang, Mà Luo",Rethinking verification for llm code generation: From generation to testing,2026,Advances in ,proceedings.neurips.các,https://proceedings.neurips.các/paper_files/paper/2025/hash/c8ec1867837f5cdaa9e61d40a8b8bb4a-Abstract-Conference.html,"https://scholar.google.com/scholar?cites=6127546441607991729&as_sdt=2005&sciodt=0,5&hl=en"," This paper critically re-evaluates LLM-based Test Case Generation (TCG), highlighting  CodeCompass effectively differentiates LLM performance across both C++ and Python. While ",https://proceedings.neurips.các/paper_files/paper/2025/file/c8ec1867837f5cdaa9e61d40a8b8bb4a-Paper-Conference.pdf,"https://scholar.google.com/scholar?q=related:sdHABAZrCVUJ:scholar.google.com/&scioq=%22large+language+model%22%7Cllm%7C%22gpt+4%22%7Cchatgpt+%22unit+test+generation%22%7C%22test+case+generation%22%7C%22automated+test+generation%22+java%7Cpython&hl=en&as_sdt=0,5&as_ylo=2025&as_yhi=2026",String A,EXCLUDE,"IC-P: Bi bo tập trung vào sinh test case d? dnh gi code generation, không phải sinh unit test tự động cho Java/Python. IC-I: Không thấy đề cập sử dụng GPT-4 ho?c GPT-4o. IC-E: Không c số liệu và? Branch Coverage hay Mutation Score.",,
161,"W Jang, RYC Kim",Automatic Test Case Generation Mechanism With Natural Language-Based Korean Requirement Specifications,2025,IEEE Access,ieeexplore.ieee.org,https://ieeexplore.ieee.org/abstract/document/11201266/,, test case generation process. We need to compare which approach is more accurate between our method and the AI LLM  were implemented using the Java programming language. ,https://ieeexplore.ieee.org/iel8/6287639/6514899/11201266.pdf,"https://scholar.google.com/scholar?q=related:9erpHRi1ANAJ:scholar.google.com/&scioq=%22large+language+model%22%7Cllm%7C%22gpt+4%22%7Cchatgpt+%22unit+test+generation%22%7C%22test+case+generation%22%7C%22automated+test+generation%22+java%7Cpython&hl=en&as_sdt=0,5&as_ylo=2025&as_yhi=2026",String A,EXCLUDE,EC-A: Không truy c?p được full-text và abstract thiếu số liệu coverage,,
162,"C Gao, X Hu, S Gao, X Xia, Z Jin",The current challenges of software engineering in the era of large language models,2025,ACM Transactions on Software ,dl.acm.org,https://dl.acm.org/doi/abs/10.1145/3712005,"https://scholar.google.com/scholar?cites=9365231039109997833&as_sdt=2005&sciodt=0,5&hl=en"," , especially unit test generation. The industry currently utilizes LLMs for unit test generation mainly  For example, Bochenek [18] tries to use ChatGPT to complete Java code templates. In ",https://dl.acm.org/doi/pdf/10.1145/3712005,"https://scholar.google.com/scholar?q=related:CSWdzQL894EJ:scholar.google.com/&scioq=%22large+language+model%22%7Cllm%7C%22gpt+4%22%7Cchatgpt+%22unit+test+generation%22%7C%22test+case+generation%22%7C%22automated+test+generation%22+java%7Cpython&hl=en&as_sdt=0,5&as_ylo=2025&as_yhi=2026",String A,EXCLUDE,EC-A: Không truy c?p được full-text và abstract thiếu số liệu coverage,,
163,"Mà Srinivasan, J Abdel",GenFair: Systematic Test Generation for Fairness Fault Detection in Large Language Models,2025,2025 IEEE International Conference on ,ieeexplore.ieee.org,https://ieeexplore.ieee.org/abstract/document/11127253/,"https://scholar.google.com/scholar?cites=1395882172513838978&as_sdt=2005&sciodt=0,5&hl=en"," A Large Language Model (LLM) is an advanced artificial  BERT models implemented in Python, specifically designed for  for the templatebased test case generation approach: 1) The ",https://arxiv.org/pdf/2506.03024,"https://scholar.google.com/scholar?q=related:guf8sHArXxMJ:scholar.google.com/&scioq=%22large+language+model%22%7Cllm%7C%22gpt+4%22%7Cchatgpt+%22unit+test+generation%22%7C%22test+case+generation%22%7C%22automated+test+generation%22+java%7Cpython&hl=en&as_sdt=0,5&as_ylo=2025&as_yhi=2026",String A,EXCLUDE,"EC-O: Paper tập trung vào fairness testing cho LLM, không phải sinh unit test tự động cho Java/Python.",,
164,"S Onishi, K Kitamura, A Kohiga, T Koita",Prompt Engineering Approaches to Reducing the Costs in LLM-Based Automated Test Case Generation,2025,World Congress in Computer ,Springer,https://link.springer.com/chapter/10.1007/978-3-032-22205-3_18,," In this research, we focus on the problem of prompt inflation in LLM-based test case generation. We  In this study, we used three types of Python project configurations as the dataset: ",,"https://scholar.google.com/scholar?q=related:_l_M7oazzM8J:scholar.google.com/&scioq=%22large+language+model%22%7Cllm%7C%22gpt+4%22%7Cchatgpt+%22unit+test+generation%22%7C%22test+case+generation%22%7C%22automated+test+generation%22+java%7Cpython&hl=en&as_sdt=0,5&as_ylo=2025&as_yhi=2026",String A,EXCLUDE,"IC-I, IC-E: Abstract không đề cập sử dụng GPT-4 ho?c GPT-4o, cung không c số liệu thực nghiệm và? Branch Coverage hay Mutation Score.",,
165,"JA Nuh, TW Koh, MH Osman, B Lawal",LLMFuzzTestGen: From Automation to Robustness via Multi-Agent LLM-Driven Fuzzing and Feedback Loops,2025,2025 7th ,ieeexplore.ieee.org,https://ieeexplore.ieee.org/abstract/document/11390823/,," by applying fuzzing-inspired, LLM-driven testing to more general-purpose Python programs.  each step of the LLM-powered automated test generation, execution, and feedback loop. ",,"https://scholar.google.com/scholar?q=related:8JORA3_lyJ4J:scholar.google.com/&scioq=%22large+language+model%22%7Cllm%7C%22gpt+4%22%7Cchatgpt+%22unit+test+generation%22%7C%22test+case+generation%22%7C%22automated+test+generation%22+java%7Cpython&hl=en&as_sdt=0,5&as_ylo=2025&as_yhi=2026",String A,EXCLUDE,IC-I: Không c thông tin và? việc sử dụng GPT-4 ho?c GPT-4o; IC-E: Không c số liệu thực nghiệm và? Branch Coverage ho?c Mutation Score.,,
166,"J Kong, X Xie, Mà Cheng, S Liu, X Du",ContrastRepair: Enhancing Conversation-Based Automated Program Repair via Contrastive Test Case Pairs,2025,ACM Transactions on ,dl.acm.org,https://dl.acm.org/doi/abs/10.1145/3719345,"https://scholar.google.com/scholar?cites=15000422675073613859&as_sdt=2005&sciodt=0,5&hl=en"," dataset, HumanEval-Java, which was published after the training of the ChatGPT models.  6.3 Automated Test Generation Automated test generation is a widely used technique for ",https://dl.acm.org/doi/full/10.1145/3719345,"https://scholar.google.com/scholar?q=related:I0B6hPI0LNAJ:scholar.google.com/&scioq=%22large+language+model%22%7Cllm%7C%22gpt+4%22%7Cchatgpt+%22unit+test+generation%22%7C%22test+case+generation%22%7C%22automated+test+generation%22+java%7Cpython&hl=en&as_sdt=0,5&as_ylo=2025&as_yhi=2026",String A,EXCLUDE,EC-A: Không truy c?p được full-text và abstract thiếu số liệu coverage,,
167,"R Krishna, R Pan, S Sinha, S Tamilselvam",Codellm-devkit: A framework for contextualizing code llms with program analysis insights,2025,Proceedings of the 33rd ,dl.acm.org,https://dl.acm.org/doi/abs/10.1145/3696630.3728555,"https://scholar.google.com/scholar?cites=5286705763425878105&as_sdt=2005&sciodt=0,5&hl=en"," LLM use cases, according to our participants, were focused on Java followed closely by Python,  of the automated approach of unit test generation using LLM. Broadly, the approach is ",https://dl.acm.org/doi/pdf/10.1145/3696630.3728555,"https://scholar.google.com/scholar?q=related:WYACteEmXkkJ:scholar.google.com/&scioq=%22large+language+model%22%7Cllm%7C%22gpt+4%22%7Cchatgpt+%22unit+test+generation%22%7C%22test+case+generation%22%7C%22automated+test+generation%22+java%7Cpython&hl=en&as_sdt=0,5&as_ylo=2025&as_yhi=2026",String A,EXCLUDE,EC-A: Không truy c?p được full-text và abstract thiếu số liệu coverage,,
168,"Y Huang, Y Yang, Mà Sun, J Wu, Q Li, Z Lu",OptFuzz: Enhancing Compiler Testing via LLM-Powered Compilation Option Generation,,ACM Transactions on ,dl.acm.org,https://dl.acm.org/doi/abs/10.1145/3817602,," , test case generation and error localization. Titanfuzz proposed using LLMs to generate code snippets directly and synthesize Python  LLM significantly reduces test case generation ",https://dl.acm.org/doi/pdf/10.1145/3817602,"https://scholar.google.com/scholar?q=related:ZcZ8a2b1ojQJ:scholar.google.com/&scioq=%22large+language+model%22%7Cllm%7C%22gpt+4%22%7Cchatgpt+%22unit+test+generation%22%7C%22test+case+generation%22%7C%22automated+test+generation%22+java%7Cpython&hl=en&as_sdt=0,5&as_ylo=2025&as_yhi=2026",String A,EXCLUDE,IC-Y: Nam xuất bản 0 < 2023,,
169,"SB Hossain, MB Dwyer",Togll: Correct and strong test oracle generation with llms,2025,2025 IEEE/ACM 47th International ,ieeexplore.ieee.org,https://ieeexplore.ieee.org/abstract/document/11029748/,"https://scholar.google.com/scholar?cites=7582427111785893765&as_sdt=2005&sciodt=0,5&hl=en"," Java projects. Utilizing the most effective finetuned LLM and prompt pair, we introduce TOGLL, a novel LLM- This benchmark is widely recognized for unit test generation. To construct ",https://arxiv.org/pdf/2405.03786,"https://scholar.google.com/scholar?q=related:hQ9K5UgxOmkJ:scholar.google.com/&scioq=%22large+language+model%22%7Cllm%7C%22gpt+4%22%7Cchatgpt+%22unit+test+generation%22%7C%22test+case+generation%22%7C%22automated+test+generation%22+java%7Cpython&hl=en&as_sdt=0,5&as_ylo=2025&as_yhi=2026",String A,EXCLUDE,"IC-I: Bi bo sử dụng 'finetuned LLM' (mà hnh được tinh ch?nh), không đề cập đến GPT-4 ho?c GPT-4o. GPT-4 không hỗ trợ fine-tuning, do d không dp ?ng tiêu chí bắt buộc sử dụng GPT-4.",,
170,"F Tambon, A Moradi-Dakhel, A Nikanjam",Bugs in large language models generated code: An empirical study,2025,Empirical Software ,Springer,https://link.springer.com/article/10.1007/s10664-025-10614-4,"https://scholar.google.com/scholar?cites=6076548212120243826&as_sdt=2005&sciodt=0,5&hl=en"," Out of the 6,900 Python samples in CoderEval (2,300 per LLM), our study was restricted to code fragments falling into one of the following runnable levels: self_runnable (without ",https://arxiv.org/pdf/2403.08937,"https://scholar.google.com/scholar?q=related:ck72a2c8VFQJ:scholar.google.com/&scioq=%22large+language+model%22%7Cllm%7C%22gpt+4%22%7Cchatgpt+%22unit+test+generation%22%7C%22test+case+generation%22%7C%22automated+test+generation%22+java%7Cpython&hl=en&as_sdt=0,5&as_ylo=2025&as_yhi=2026",String A,EXCLUDE,"IC-P: Bi bo tập trung vào phn tch lỗi trong mà ngu?n do LLM t?o ra, không phải sinh Unit Test tự động. IC-I: Không sử dụng GPT-4 ho?c GPT-4o (dng CodeGen, PanGu-Coder, Codex). IC-E: Không c số liệu và? Branch Coverage hay Mutation Score.",,
171,"X Zhu, W Zhou, QL Han, W Ma, S Wen",When software security meets large language models: A survey,2025,IEEE/CAA Journal of ,ieeexplore.ieee.org,https://ieeexplore.ieee.org/abstract/document/10846956/,"https://scholar.google.com/scholar?cites=8262449722075332360&as_sdt=2005&sciodt=0,5&hl=en"," an LLM, prompt engineering is a lightweight way to use the LLM generate function calls for test case generation or to generate  unit tests for Python and Java programs [60]. Because this ",https://www.ieee-jas.net/article/doi/10.1109/JAS.2024.124971?viewType=HTML&pageType=en,"https://scholar.google.com/scholar?q=related:CD_T8j4eqnIJ:scholar.google.com/&scioq=%22large+language+model%22%7Cllm%7C%22gpt+4%22%7Cchatgpt+%22unit+test+generation%22%7C%22test+case+generation%22%7C%22automated+test+generation%22+java%7Cpython&hl=en&as_sdt=0,5&as_ylo=2025&as_yhi=2026",String A,EXCLUDE,EC-A: Không truy c?p được full-text và abstract thiếu số liệu coverage,,
172,"EM Pasca, D Delinschi, R Erdei, O Matei","LLM-Driven, Self-Improving Framework for Security Test Automation: Leveraging Karate DSL for Augmented API Resilience",2025,IEEE Access,ieeexplore.ieee.org,https://ieeexplore.ieee.org/abstract/document/10942340/,"https://scholar.google.com/scholar?cites=2770643227573067489&as_sdt=2005&sciodt=0,5&hl=en"," TEST CASE GENERATION PROCESS With the knowledge base data in place and configuration details set in the config file for the RAG System, our test case generation process can ",https://ieeexplore.ieee.org/iel8/6287639/6514899/10942340.pdf,"https://scholar.google.com/scholar?q=related:4Z7VAlZNcyYJ:scholar.google.com/&scioq=%22large+language+model%22%7Cllm%7C%22gpt+4%22%7Cchatgpt+%22unit+test+generation%22%7C%22test+case+generation%22%7C%22automated+test+generation%22+java%7Cpython&hl=en&as_sdt=0,5&as_ylo=2025&as_yhi=2026",String A,EXCLUDE,EC-A: Không truy c?p được full-text và abstract thiếu số liệu coverage,,
173,"I Malashin, I Masich, S Kurashkin",Automated Evolutionary Hyperparameter Tuning for NLP-Based Test Case Generation,2025,2025 40th IEEE/ACM ,ieeexplore.ieee.org,https://ieeexplore.ieee.org/abstract/document/11334473/,," When necessary, a code-generation large language model synthesizes implementationspecific assertions and API calls under constrained prompts. Generated code undergoes static ",,"https://scholar.google.com/scholar?q=related:2R8cpU3cMRYJ:scholar.google.com/&scioq=%22large+language+model%22%7Cllm%7C%22gpt+4%22%7Cchatgpt+%22unit+test+generation%22%7C%22test+case+generation%22%7C%22automated+test+generation%22+java%7Cpython&hl=en&as_sdt=0,5&as_ylo=2025&as_yhi=2026",String A,EXCLUDE,"IC-E: Abstract không đề cập đến số liệu thực nghiệm cụ thể và? Branch Coverage ho?c Mutation Score, không dp ?ng tiêu chí bắt buộc.",,
174,"Z Liu, H Wang, T Xu, B Wang",RAG-Driven multiple assertions generation with large language models,2025,Empirical Software Engineering,Springer,https://link.springer.com/article/10.1007/s10664-025-10641-1,"https://scholar.google.com/scholar?cites=10465448174815165314&as_sdt=2005&sciodt=0,5&hl=en"," the Java project containing the test code snippets as the knowledge base, providing the LLM  For instances involving Javas primitive types, we instruct the LLM to determine whether ",,"https://scholar.google.com/scholar?q=related:gjseq6q9PJEJ:scholar.google.com/&scioq=%22large+language+model%22%7Cllm%7C%22gpt+4%22%7Cchatgpt+%22unit+test+generation%22%7C%22test+case+generation%22%7C%22automated+test+generation%22+java%7Cpython&hl=en&as_sdt=0,5&as_ylo=2025&as_yhi=2026",String A,UNSURE,IC-I: Không c thông tin và? việc sử dụng GPT-4 trong abstract snippet; IC-E: Không c số liệu cụ thể và? Branch Coverage ho?c Mutation Score. C?n ki?mà tra full-text.,Include,"Đọc full-text, xác nhận đủ IC"
175,"S Boorlagadda, NNS Atluri, MM lmez",Comparative Evaluation of Large Language Models for Test-Skeleton Generation,2025,2025 IEEE Frontiers ,ieeexplore.ieee.org,https://ieeexplore.ieee.org/abstract/document/11328463/,"https://scholar.google.com/scholar?cites=11907801388282973779&as_sdt=2005&sciodt=0,5&hl=en", to evaluate LLM performance in test case generation. Their  a precedent for comparative LLM assessment in this space.  and semantic consistency of LLM-generated test content. Their ,https://arxiv.org/pdf/2509.04644,"https://scholar.google.com/scholar?q=related:U46CvEUCQaUJ:scholar.google.com/&scioq=%22large+language+model%22%7Cllm%7C%22gpt+4%22%7Cchatgpt+%22unit+test+generation%22%7C%22test+case+generation%22%7C%22automated+test+generation%22+java%7Cpython&hl=en&as_sdt=0,5&as_ylo=2025&as_yhi=2026",String A,EXCLUDE,"IC-P: Bi bo tập trung vào sinh test skeleton cho Ruby on Rails, không phải Java/Python. IC-E: Không c số liệu và? Branch Coverage ho?c Mutation Score.",,
176,DB Bose,From prompts to properties: Rethinking llm code generation with property-based testing,2025,Proceedings of the 33rd ACM International Conference ,dl.acm.org,https://dl.acm.org/doi/abs/10.1145/3696630.3728702,"https://scholar.google.com/scholar?cites=7433882487824416277&as_sdt=2005&sciodt=0,5&hl=en"," As a result, LLM-generated code may pass unit tests while  verification mechanism for LLM-generated code. Instead of  In this study, we explore the impact of PBT in LLM-driven code ",https://dl.acm.org/doi/pdf/10.1145/3696630.3728702,"https://scholar.google.com/scholar?q=related:FX7FfLx0KmcJ:scholar.google.com/&scioq=%22large+language+model%22%7Cllm%7C%22gpt+4%22%7Cchatgpt+%22unit+test+generation%22%7C%22test+case+generation%22%7C%22automated+test+generation%22+java%7Cpython&hl=en&as_sdt=0,5&as_ylo=2025&as_yhi=2026",String A,EXCLUDE,EC-A: Không truy c?p được full-text và abstract thiếu số liệu coverage,,
177,"I Bouzenia, Mà Pradel","You name it, i run it: An llm agent to execute tests of arbitrary projects",2025,Proceedings of the ACM on Software Engineering,dl.acm.org,https://dl.acm.org/doi/abs/10.1145/3728922,"https://scholar.google.com/scholar?cites=15772576651984227686&as_sdt=2005&sciodt=0,5&hl=en", By LLM agent we here mean a system that uses an LLM to autonomously interact with a set  Python as their main language. The results show that Flapy reaches results similar to LLM,https://dl.acm.org/doi/pdf/10.1145/3728922,"https://scholar.google.com/scholar?q=related:Zs0j9uVy49oJ:scholar.google.com/&scioq=%22large+language+model%22%7Cllm%7C%22gpt+4%22%7Cchatgpt+%22unit+test+generation%22%7C%22test+case+generation%22%7C%22automated+test+generation%22+java%7Cpython&hl=en&as_sdt=0,5&as_ylo=2025&as_yhi=2026",String A,EXCLUDE,EC-A: Không truy c?p được full-text và abstract thiếu số liệu coverage,,
178,"S Deng, R Huang, Mà Zhang, C Cui, D Towey",Lrasgen: Llm-based restful api specification generation,2025,ACM Transactions on ,dl.acm.org,https://dl.acm.org/doi/abs/10.1145/3810241,"https://scholar.google.com/scholar?cites=9568507863537023292&as_sdt=2005&sciodt=0,5&hl=en"," these code files to the LLM (which uses designed prompts  parameters and responses through the LLM; 5) Identifying the  five programming languages (Java, Kotlin, Python, C#, and ",https://dl.acm.org/doi/pdf/10.1145/3810241,"https://scholar.google.com/scholar?q=related:PPmnrDQryoQJ:scholar.google.com/&scioq=%22large+language+model%22%7Cllm%7C%22gpt+4%22%7Cchatgpt+%22unit+test+generation%22%7C%22test+case+generation%22%7C%22automated+test+generation%22+java%7Cpython&hl=en&as_sdt=0,5&as_ylo=2025&as_yhi=2026",String A,EXCLUDE,EC-A: Không truy c?p được full-text và abstract thiếu số liệu coverage,,
179,"D Handa, KK Nikhil, K Kanagaraj",Test Case Generation using Graph-based Deep Learning Methods,2025, and Internet of ,ieeexplore.ieee.org,https://ieeexplore.ieee.org/abstract/document/11040354/,"https://scholar.google.com/scholar?cites=5385607108740736947&as_sdt=2005&sciodt=0,5&hl=en", describes an automatic test case generation approach for Java programs to  LLM dependability.The abilities of models such as T5 or GPT-3 show that automatic test case generation ,,"https://scholar.google.com/scholar?q=related:s2dPmCGFvUoJ:scholar.google.com/&scioq=%22large+language+model%22%7Cllm%7C%22gpt+4%22%7Cchatgpt+%22unit+test+generation%22%7C%22test+case+generation%22%7C%22automated+test+generation%22+java%7Cpython&hl=en&as_sdt=0,5&as_ylo=2025&as_yhi=2026",String A,EXCLUDE,"IC-I: Bi bo ch? đề cập GPT-3, không sử dụng GPT-4 ho?c GPT-4o; IC-E: Không c số liệu thực nghiệm cụ thể và? Branch Coverage ho?c Mutation Score.",,
180,"Mà Barboni, F Lampa, A Morichetta",Mutant-driven test generation for ethereum smart contracts via llms,2025,2025 IEEE ,ieeexplore.ieee.org,https://ieeexplore.ieee.org/abstract/document/11127247/,"https://scholar.google.com/scholar?cites=4996954554076190944&as_sdt=2005&sciodt=0,5&hl=en", Automated test generation has long been a critical focus in software testing. Our work investigates the intersection of LLM- to iteratively improve the correctness and quality of Java unit ,,"https://scholar.google.com/scholar?q=related:4Fh7IrG_WEUJ:scholar.google.com/&scioq=%22large+language+model%22%7Cllm%7C%22gpt+4%22%7Cchatgpt+%22unit+test+generation%22%7C%22test+case+generation%22%7C%22automated+test+generation%22+java%7Cpython&hl=en&as_sdt=0,5&as_ylo=2025&as_yhi=2026",String A,EXCLUDE,"IC-P: Tr?ng tìm c?t li là sinh test cho smart contract Ethereum, không phải unit test Java/Python.",,
181,"Y Wei, K Chi, S Du, X Xie, Z Geng, Y Han, Z Li",Large Language Model Driven Automated Network Protocol Testing,2025,Proceedings of the ,dl.acm.org,https://dl.acm.org/doi/abs/10.1145/3744200.3744763,"https://scholar.google.com/scholar?cites=1019002118012781868&as_sdt=2005&sciodt=0,5&hl=en", LLM-empowered architecture specifically designed for network protocol testing. (2) A hybrid test case generation  We preliminarily implemented NeTestLLM in Python with 4974 lines of ,https://dl.acm.org/doi/pdf/10.1145/3744200.3744763,"https://scholar.google.com/scholar?q=related:LMWFBQc5JA4J:scholar.google.com/&scioq=%22large+language+model%22%7Cllm%7C%22gpt+4%22%7Cchatgpt+%22unit+test+generation%22%7C%22test+case+generation%22%7C%22automated+test+generation%22+java%7Cpython&hl=en&as_sdt=0,5&as_ylo=2025&as_yhi=2026",String A,EXCLUDE,EC-A: Không truy c?p được full-text và abstract thiếu số liệu coverage,,
182,"S Masuda, S Kouzawa, K Sezai",Generating high-level test cases from requirements using LLM: An industry study,2026," , Data Sciences and ",ieeexplore.ieee.org,https://ieeexplore.ieee.org/abstract/document/11467785/,"https://scholar.google.com/scholar?cites=10563282031058822026&as_sdt=2005&sciodt=0,5&hl=en", test case generation techniques from requirements using LLMs within the industrial sector. This paper envisions the automation of high-level test case generation  test case generation. ,https://arxiv.org/pdf/2510.03641,"https://scholar.google.com/scholar?q=related:iiOHYwpRmJIJ:scholar.google.com/&scioq=%22large+language+model%22%7Cllm%7C%22gpt+4%22%7Cchatgpt+%22unit+test+generation%22%7C%22test+case+generation%22%7C%22automated+test+generation%22+java%7Cpython&hl=en&as_sdt=0,5&as_ylo=2025&as_yhi=2026",String A,EXCLUDE,"IC-P: Bi bo tập trung vào sinh high-level test cases t? ti li?u yêu cầu, không phải unit test tự động.",,
183,"Z Ji, P Ma, Z Li, Z Wang, S Wang",Causality-Aided Evaluation and Explanation of Large Language Model-Based Code Generation,2025,Proceedings of the ACM on Software ,dl.acm.org,https://dl.acm.org/doi/abs/10.1145/3728938,"https://scholar.google.com/scholar?cites=1983429670737394245&as_sdt=2005&sciodt=0,5&hl=en"," search-based software engineering, such as test case generation [72]. The genetic algorithm  However, given the popularity of GPT-family models and the Python language, our findings ",https://dl.acm.org/doi/pdf/10.1145/3728938,"https://scholar.google.com/scholar?q=related:RbpF4caOhhsJ:scholar.google.com/&scioq=%22large+language+model%22%7Cllm%7C%22gpt+4%22%7Cchatgpt+%22unit+test+generation%22%7C%22test+case+generation%22%7C%22automated+test+generation%22+java%7Cpython&hl=en&as_sdt=0,5&as_ylo=2025&as_yhi=2026",String A,EXCLUDE,EC-A: Không truy c?p được full-text và abstract thiếu số liệu coverage,,
184,"Mà Du, LA Tuan, B Ji, X Wu, Y Qing",Codearena: A collective evaluation platform for llm code generation,2025,Proceedings of the ,aclanthology.org,https://aclanthology.org/2025.acl-demo.48/,"https://scholar.google.com/scholar?cites=9148487091916340178&as_sdt=2005&sciodt=0,5&hl=en"," Test Case Generation. Since most online coding platforms do not disclose their test cases, we develop an automated test case generation workflow for Benchmark Curators to address ",https://aclanthology.org/2025.acl-demo.48.pdf,"https://scholar.google.com/scholar?q=related:0nvrEYr09X4J:scholar.google.com/&scioq=%22large+language+model%22%7Cllm%7C%22gpt+4%22%7Cchatgpt+%22unit+test+generation%22%7C%22test+case+generation%22%7C%22automated+test+generation%22+java%7Cpython&hl=en&as_sdt=0,5&as_ylo=2025&as_yhi=2026",String A,EXCLUDE,"EC-O: Bi bo tập trung vào n?n t?ng dnh gi khả năng sinh code của LLM, không phải sinh Unit Test tự động cho Java/Python.",,
