id,title,authors,year,venue,search_strings
1,"(Programs), Proofs and Refutations (and Tests and Mutants)","Groce, Alex",2024,"Proceedings of the 2024 ACM SIGPLAN International Symposium on New Ideas, New Paradigms, and Reflections on Programming and Software",String A
2,ContrastRepair: Enhancing Conversation-Based Automated Program Repair via Contrastive Test Case Pairs,"Kong, Jiaolong; Xie, Xiaofei; Cheng, Mingfei; Liu, Shangqing; Du, Xiaoning; Guo, Qi",2025,ACM Transactions on Software Engineering and Methodology,"String A, String B"
3,CITYWALK: Enhancing LLM-Based C++ Unit Test Generation via Project-Dependency Awareness and Language-Specific Knowledge,"Zhang, Yuwei; Lu, Qingyuan; Liu, Kai; Dou, Wensheng; Zhu, Jiaxin; Qian, Li; Zhang, Chunxi; Lin, Zheng; Wei, Jun",2026,ACM Transactions on Software Engineering and Methodology,"String A, String B, String C"
4,Citadel : Context Similarity Based Deep Learning Framework Bug Finding,"Zhang, Xiaoyu; Zhai, Juan; Ma, Shiqing; Wang, Shiwei; Shen, Chao",2025,ACM Transactions on Software Engineering and Methodology,String A
5,DrWASI : LLM-assisted Differential Testing for WebAssembly System Interface Implementations,"Zhang, Yixuan; He, Ningyu; Gao, Jianting; Cao, Shangtong; Liu, Kaibo; Wang, Haoyu; Ma, Yun; Huang, Gang; Liu, Xuanzhe",2026,ACM Transactions on Software Engineering and Methodology,String A
6,FAVDisco : Modeling and Discovering File Access Vulnerabilities,"Zhao, Beibei; Feng, Wenjie; Guo, Qingli; Sun, Yingli; Gu, Fangming; Zhang, Bolun; Gong, Xiaorui; Li, Hong",2026,ACM Transactions on Software Engineering and Methodology,"String A, String B"
7,Testing and Mitigating Ethically Inconsistent Suggestions of Large Language Models with Reflective Equilibrium,"Ma, Pingchuan; Wang, Zhaoyu; Li, Zongjie; Ji, Zhenlan; Sun, Ao; Rahmel, Juergen; Wang, Shuai",2026,ACM Transactions on Software Engineering and Methodology,String A
8,Vital : Vulnerability-Oriented Symbolic Execution via Type-Unsafe Pointer-Guided Monte Carlo Tree Search,"Tu, Haoxin; Jiang, Lingxiao; Böhme, Marcel",2026,ACM Transactions on Software Engineering and Methodology,"String A, String B"
9,A 2030 Roadmap for Software Engineering,"Pezzè, Mauro; Abrahão, Silvia; Penzenstadler, Birgit; Poshyvanyk, Denys; Roychoudhury, Abhik; Yue, Tao",2025,ACM Transactions on Software Engineering and Methodology,"String A, String B"
10,A Case for Learned Cloud Emulators,"Bhatnagar, Archit; Qiu, Yiming; McClure, Sarah; Ratnasamy, Sylvia; Chen, Ang",2025,Proceedings of the 24th ACM Workshop on Hot Topics in Networks,String A
11,A Catalog of Data Smells for Coding Tasks,"Vitale, Antonio; Oliveto, Rocco; Scalabrino, Simone",2025,ACM Transactions on Software Engineering and Methodology,String A
12,A Comparative Study of Android Performance Issues in Real-world Applications and Literature,"Liao, Dianshu; Pan, Shidong; Yang, Siyuan; Zhao, Yanjie; Xing, Zhenchang; Sun, Xiaoyu",2025,ACM Transactions on Software Engineering and Methodology,String B
13,A Comparative Study on ChatGPT and Checklist as Support Tools for Unit Testing Education,"Fang, Zihan; Li, Jiliang; Liang, Anda; Bai, Gina R.; Huang, Yu",2025,Proceedings of the 33rd ACM International Conference on the Foundations of Software Engineering,String B
14,A Comprehensive Evaluation of Parameter-Efficient Fine-Tuning on Code Smell Detection,"Zhang, Beiqi; Liang, Peng; Zhou, Xin; Zhou, Xiyu; Lo, David; Feng, Qiong; Li, Zengyang; Li, Lin",2026,ACM Transactions on Software Engineering and Methodology,String A
15,A Comprehensive Study on Large Language Models for Mutation Testing,"Wang, Bo; Chen, Mingda; Deng, Ming; Lin, Youfang; Harman, Mark; Papadakis, Mike; Zhang, Jie M.",2026,ACM Transactions on Software Engineering and Methodology,"String A, String B, String C"
16,"A Comprehensive Survey on Database Management System Fuzzing: Techniques, Taxonomy and Evaluation","Gao, Xiyue; Liu, Zhuang; Cui, Jiangtao; Li, Hui; Zhang, Hui; Wei, Kewei; Zhao, Kankan",2026,ACM Computing Surveys,"String A, String B, String C"
17,A DSL for Testing LLMs for Fairness and Bias,"Morales, Sergio; Clarisó, Robert; Cabot, Jordi",2024,Proceedings of the ACM/IEEE 27th International Conference on Model Driven Engineering Languages and Systems,String A
18,A First Look at the Inheritance-Induced Redundant Test Execution,"Kim, Dong Jae; Yang, Jinqiu; Chen, Tse-Hsun",2024,Proceedings of the IEEE/ACM 46th International Conference on Software Engineering,String B
19,A Large-Scale Empirical Review of Patch Correctness Checking Approaches,"Yang, Jun; Wang, Yuehan; Lou, Yiling; Wen, Ming; Zhang, Lingming",2023,Proceedings of the 31st ACM Joint European Software Engineering Conference and Symposium on the Foundations of Software Engineering,"String A, String B"
20,A Large-Scale Empirical Study on Fine-Tuning Large Language Models for Unit Testing,"Shang, Ye; Zhang, Quanjun; Fang, Chunrong; Gu, Siqi; Zhou, Jianyi; Chen, Zhenyu",2025,Proceedings of the ACM on Software Engineering,"String A, String B"
21,A Large-Scale Evaluation for Log Parsing Techniques: How Far Are We?,"Jiang, Zhihan; Liu, Jinyang; Huang, Junjie; Li, Yichen; Huo, Yintong; Gu, Jiazhen; Chen, Zhuangbin; Zhu, Jieming; Lyu, Michael R.",2024,Proceedings of the 33rd ACM SIGSOFT International Symposium on Software Testing and Analysis,String B
22,A Method for Efficient Structured Data Generation with Large Language Models,"Hou, Zongzhi; Zhao, Ruohan; Li, Zhongyang; Wang, Zheng; Wu, Yizhen; Gou, Junwei; Zhu, Zhifeng",2024,Proceedings of the 2nd Workshop on Large Generative Models Meet Multimodal Applications,"String A, String B"
23,A Model of How Students Engineer Test Cases With Feedback,"Shin, Austin M.; Kazerouni, Ayaan M.",2024,ACM Transactions on Computing Education,"String A, String B"
24,A Multi-Agent Coding Assistant for Cloud-Native Development: From Requirements to Deployable Microservices,"Guan, Tian",2025,Proceedings of the 2025 6th International Conference on Computer Science and Management Technology,String A
25,A Multi-Dimensional Quality Evaluation of Code Generated by LLM-Based Tools Across Multiple Programming Languages,"Li, Ruimeng; Mo, Ran; Zeng, Yao; Liu, Zili; Li, Zengyang; Ma, Yutao",2026,ACM Transactions on Software Engineering and Methodology,String A
26,A Pair Programming Framework for Code Generation via Multi-Plan Exploration and Feedback-Driven Refinement,"Zhang, Huan; Cheng, Wei; Wu, Yuhan; Hu, Wei",2024,Proceedings of the 39th IEEE/ACM International Conference on Automated Software Engineering,String A
27,A Pilot Study in Surveying Data Challenges of Automatic Software Engineering Tasks,"Dong, Liming; Lu, Qinghua; Zhu, Liming",2024,Proceedings of the 4th International Workshop on Software Engineering and AI for Data Quality in Cyber-Physical Systems/Internet of Things,String B
28,A Qualitative Analysis of Fuzzer Usability and Challenges,"Zhao, Yunze; Guo, Wentao; Goldstein, Harrison; Votipka, Daniel; Fulton, Kelsey R.; Mazurek, Michelle L.",2025,Proceedings of the 2025 ACM SIGSAC Conference on Computer and Communications Security,String B
29,A Quantitative and Qualitative Evaluation of LLM-Based Explainable Fault Localization,"Kang, Sungmin; An, Gabin; Yoo, Shin",2024,Proceedings of the ACM on Software Engineering,"String A, String B"
30,A Research Roadmap for Augmenting Software Engineering Processes and Software Products with Generative AI,"Amalfitano, Domenico; Metzger, Andreas; Autili, Marco; Fulcini, Tommaso; Hey, Tobias; Keim, Jan; Pelliccione, Patrizio; Scotti, Vincenzo; Koziolek, Anne; Mirandola, Raffaela; Vogelsang, Andreas",2026,ACM Transactions on Software Engineering and Methodology,"String A, String B"
31,A Roadmap for Software Testing in Open-Collaborative and AI-Powered Era,"Wang, Qing; Wang, Junjie; Li, Mingyang; Wang, Yawen; Liu, Zhe",2025,ACM Transactions on Software Engineering and Methodology,String B
32,A Survey of Learning-based Automated Program Repair,"Zhang, Quanjun; Fang, Chunrong; Ma, Yuxiang; Sun, Weisong; Chen, Zhenyu",2024,ACM Transactions on Software Engineering and Methodology,"String A, String B"
33,A Survey of Operating System Kernel Fuzzing,"Xu, Jiacheng; Jiang, Shihao; Sun, He; Wang, Qinying; Zhang, Mingming; Li, Xiang; Shen, Kaiwen; Zhang, Charles; Ji, Shouling; Cheng, Peng; Chen, Jiming",2025,ACM Transactions on Software Engineering and Methodology,String B
34,A Survey of Protocol Fuzzing,"Zhang, Xiaohan; Zhang, Cen; Li, Xinghua; Du, Zhengjie; Mao, Bing; Li, Yuekang; Zheng, Yaowen; Li, Yeting; Pan, Li; Liu, Yang; Deng, Robert",2025,ACM Computing Surveys,"String A, String B"
35,A Survey of Research in Large Language Models for Electronic Design Automation,"Pan, Jingyu; Zhou, Guanglei; Chang, Chen-Chia; Jacobson, Isaac; Hu, Jiang; Chen, Yiran",2025,ACM Transactions on Design Automation of Electronic Systems,String A
36,A Survey of Testing Techniques Based on Large Language Models,"Qi, Fei; Hou, Yingnan; Lin, Ning; Bao, Shanshan; Xu, Nuo",2024,Proceedings of the 2024 International Conference on Computer and Multimedia Technology,String B
37,A Survey on Feedback Types in Automated Programming Assessment Systems,"Frankford, Eduard; Antensteiner, Tobias; Vierhauser, Michael; Sauerwein, Clemens; Wallner, Vivien; Groher, Iris; Plösch, Reinhold; Breu, Ruth",2026,ACM Transactions on Computing Education,String B
38,A Survey on LLM-based Code Generation for Low-Resource and Domain-Specific Programming Languages,"Joel, Sathvik; Wu, Jie; Fard, Fatemeh",2025,ACM Transactions on Software Engineering and Methodology,String A
39,A Survey on Large Language Models for Code Generation,"Jiang, Juyong; Wang, Fan; Shen, Jiasi; Kim, Sungju; Kim, Sunghun",2026,ACM Transactions on Software Engineering and Methodology,String A
40,"A Systematic Evaluation of Large Code Models in API Suggestion: When, Which, and How","Wang, Chaozheng; Gao, Shuzheng; Gao, Cuiyun; Wang, Wenxuan; Chong, Chun Yong; Gao, Shan; Lyu, Michael R.",2024,Proceedings of the 39th IEEE/ACM International Conference on Automated Software Engineering,String A
41,A Systematic Literature Review of Parameter-Efficient Fine-Tuning for Large Code Models,"Afrin, Saima; Haque, Md Zahidul; Mastropaolo, Antonio",2026,ACM Transactions on Software Engineering and Methodology,String A
42,A Systematic Literature Review on Automated Software Vulnerability Detection Using Machine Learning,"Shiri Harzevili, Nima; Boaye Belle, Alvine; Wang, Junjie; Wang, Song; Jiang, Zhen Ming (Jack); Nagappan, Nachiappan",2025,ACM Computing Surveys,"String A, String B"
43,A Systematic Literature Review on Large Language Models for Automated Program Repair,"Zhang, Quanjun; Fang, Chunrong; Xie, Yang; Ma, Yuxiang; Sun, Weisong; Yang, Yun; Chen, Zhenyu",2026,ACM Transactions on Software Engineering and Methodology,"String A, String B"
44,A Theory of Scientific Programming Efficacy,"Pertseva, Elizaveta; Chang, Melinda; Zaman, Ulia; Coblenz, Michael",2024,Proceedings of the IEEE/ACM 46th International Conference on Software Engineering,String A
45,A Tool for Generating Exceptional Behavior Tests With Large Language Models,"Zhong, Linghan; Yuan, Samuel; Zhang, Jiyang; Liu, Yu; Nie, Pengyu; Li, Junyi Jessy; Gligoric, Milos",2025,Proceedings of the 33rd ACM International Conference on the Foundations of Software Engineering,String A
46,A compatibility test method for Android applications based on multimodal large models in crowdsourcing scenarios,"Guo, Keying; Zhao, Peiling; Cao, Yuzhong",2025,Proceedings of the 2025 5th International Conference on Computer Network Security and Software Engineering,String A
47,AI Assistants to Enhance and Exploit the PETSc Knowledge Base,"Smith, Barry; Zhang, Junchao; Zhang, Hong; McInnes, Lois Curfman; Keceli, Murat; Vasan, Archit; Balay, Satish; Isaac, Toby; Chen, Le; Vishwanath, Venkatram",2025,Workshop Proceedings of the 54th International Conference on Parallel Processing,String A
48,AI in the Software Development Lifecycle: Insights and Open Research Questions,"Guimaraes, Everton; Nascimento, Nathalia",2025,Proceedings of the 33rd ACM International Conference on the Foundations of Software Engineering,String A
49,AI-Generated Test Scripts for Web E2E Testing with ChatGPT and Copilot: A Preliminary Study,"Leotta, Maurizio; Yousaf, Hafiz Zeeshan; Ricca, Filippo; Garcia, Boni",2024,Proceedings of the 28th International Conference on Evaluation and Assessment in Software Engineering,"String A, String B, String C"
50,AI5GTest: AI-Driven Specification-Aware Automated Testing and Validation of 5G O-RAN Components,"Ganiyu, Abiodun; Gajjar, Pranshav; Shah, Vijay K",2025,18th ACM Conference on Security and Privacy in Wireless and Mobile Networks,String A
51,API-Guided Dataset Synthesis to Finetune Large Code Models,"Li, Zongjie; Wu, Daoyuan; Wang, Shuai; Su, Zhendong",2025,Proceedings of the ACM on Programming Languages,"String A, String B"
52,ASTRA-5G: Automated Over-the-Air Security Testing and Research Architecture for 5G SA Devices,"Khandker, Syed; Guerra, Michele; Bitsikas, Evangelos; Jover, Roger Piqueras; Ranganathan, Aanjhan; Pöpper, Christina",2024,Proceedings of the 17th ACM Conference on Security and Privacy in Wireless and Mobile Networks,String A
53,Accelerating Software Development Using Generative AI: ChatGPT Case Study,"Rajbhoj, Asha; Somase, Akanksha; Kulkarni, Piyush; Kulkarni, Vinay",2024,Proceedings of the 17th Innovations in Software Engineering Conference,String A
54,Accessibility Issue Detection and Repair in Mobile Applications: A Systematic Literature Review,"Liu, Zhenyu; Yao, Dengfeng; Liu, Hongzhe; Xu, Cheng; Huang, Huiyue",2026,ACM Transactions on Software Engineering and Methodology,"String A, String B"
55,Activity Transition Graph Generation: How Far Are We?,"Liu, Jiakun; Zhang, Peixin; Hu, Han; Liu, Yonghui; Minn, Wei; Thung, Ferdian; Maoz, Shahar; Toch, Eran; Gao, Debin; Lo, David",2025,ACM Transactions on Software Engineering and Methodology,String A
56,"Adoption of AI Assisted Coding – Cognitive Barriers, Motivational Factors and Productivity Gains","Varanasi, Dhiraj Sm; Reddy, Y. Raghu; Potdar, Sandip; Warudkar, Himanshu S",2026,Proceedings of the 19th Innovations in Software Engineering Conference,String A
57,Advancing Code Coverage: Incorporating Program Analysis with Large Language Models,"Yang, Chen; Chen, Junjie; Lin, Bin; Wang, Ziqi; Zhou, Jianyi",2026,ACM Transactions on Software Engineering and Methodology,"String A, String B, String C"
58,AdverIntent-Agent: Adversarial Reasoning for Repair Based on Inferred Program Intent,"Ye, He; Yang, Aidan Z.H.; Hu, Chang; Wang, Yanlin; Zhang, Tao; Le Goues, Claire",2025,Proceedings of the ACM on Software Engineering,"String A, String B"
59,AgoneTest: Automated creation and assessment of Unit tests leveraging Large Language Models,"Lops, Andrea; Narducci, Fedelucio; Ragone, Azzurra; Trizio, Michelantonio",2024,Proceedings of the 39th IEEE/ACM International Conference on Automated Software Engineering,"String A, String B"
60,AlphaTrans: A Neuro-Symbolic Compositional Approach for Repository-Level Code Translation and Validation,"Ibrahimzada, Ali Reza; Ke, Kaiyao; Pawagi, Mrigank; Abid, Muhammad Salman; Pan, Rangeet; Sinha, Saurabh; Jabbarvand, Reyhaneh",2025,Proceedings of the ACM on Software Engineering,String B
61,An Approach to Generating API Test Scripts Using GPT,"Nguyen, Cuong; Bui, Huy; Nguyen, Vu; Nguyen, Tien",2023,Proceedings of the 12th International Symposium on Information and Communication Technology,"String A, String B"
62,An Empirical Study of Code Clones from Commercial AI Code Generators,"Wu, Weibin; Hu, Haoxuan; Fan, Zhaoji; Qiao, Yitong; Huang, Yizhan; Li, Yichen; Zheng, Zibin; Lyu, Michael",2025,Proceedings of the ACM on Software Engineering,String A
63,"An Empirical Study of Code Search in Intelligent Coding Assistant: Perceptions, Expectations, and Directions","Liu, Chao; Zhang, Xindong; Zhang, Hongyu; Wan, Zhiyuan; Huang, Zhan; Yan, Meng",2024,Companion Proceedings of the 32nd ACM International Conference on the Foundations of Software Engineering,String A
64,An Empirical Study on Challenges for LLM Application Developers,"Chen, Xiang; Gao, Chaoyang; Chen, Chunyang; Zhang, Guangbei; Liu, Yong",2025,ACM Transactions on Software Engineering and Methodology,String A
65,An Empirical Study on Focal Methods in Deep-Learning-Based Approaches for Assertion Generation,"He, Yibo; Huang, Jiaming; Yu, Hao; Xie, Tao",2024,Proceedings of the ACM on Software Engineering,String A
66,An Empirical Study on How Large Language Models Impact Software Testing Learning,"Mezzaro, Simone; Gambi, Alessio; Fraser, Gordon",2024,Proceedings of the 28th International Conference on Evaluation and Assessment in Software Engineering,"String A, String B"
67,An Empirical Study on the Code Refactoring Capability of Large Language Models,"Cordeiro, Jonathan; Noei, Shayan; Zou, Ying",2026,ACM Transactions on Software Engineering and Methodology,"String A, String B, String C"
68,"An Experimental Study Evaluating Cost, Adequacy, and Effectiveness of Pynguin's Test Sets","Guerino, Lucca; Vincenzi, Auri",2023,8th Brazilian Symposium on Systematic and Automated Software Testing,"String A, String B, String C"
69,An LLM Assistant for Software Project Onboarding,"Larsen, Knud Ronau; Edvall, Magnus; Ho-Quang, Truong; Dobslaw, Felix; Jolak, Rodi",2025,Proceedings of the 33rd ACM International Conference on the Foundations of Software Engineering,String A
70,An initial investigation of ChatGPT unit test generation capability,"Guilherme, Vitor; Vincenzi, Auri",2023,8th Brazilian Symposium on Systematic and Automated Software Testing,"String A, String B, String C"
71,Analyzing Developer Use of ChatGPT Generated Code in Open Source GitHub Projects,"Grewal, Balreet; Lu, Wentao; Nadi, Sarah; Bezemer, Cor-Paul",2024,Proceedings of the 21st International Conference on Mining Software Repositories,String A
72,Analyzing LLM Usage in an Advanced Computing Class in India,"Arora, Utkarsh; Garg, Anupam; Gupta, Aryan; Jain, Samyak; Mehta, Ronit; Oberoi, Rupin; Prachi; Raina, Aryaman; Saini, Manav; Sharma, Sachin; Singh, Jaskaran; Tyagi, Sarthak; Kumar, Dhruv",2025,Proceedings of the 27th Australasian Computing Education Conference,String A
73,Are Autonomous Web Agents Good Testers?,"Chevrot, Antoine; Vernotte, Alexandre; Falleri, Jean-Rémy; Blanc, Xavier; Legeard, Bruno; Cretin, Aymeric",2025,Proceedings of the ACM on Software Engineering,String A
74,Are Human Rules Necessary? Generating Reusable APIs with CoT Reasoning and In-Context Learning,"Mai, Yubo; Gao, Zhipeng; Hu, Xing; Bao, Lingfeng; Liu, Yu; Sun, JianLing",2024,Proceedings of the ACM on Software Engineering,String A
75,Are LLMs Ready for Competitive Programming? An Empirical Study,"Dang, Tran Tri; Jani, Jaronie Mohd; Ling, Huo-Chong; Tran, Linh Duc; Tran, Quang; Nguyen, Quy; Tran, Hoang; Pham, Thanh Chi",2026,Proceedings of the 2026 14th International Conference on Software and Information Engineering,"String A, String B, String C"
76,Artificial Intelligence for Software Engineering: The Journey So Far and the Road Ahead,"Ahmed, Iftekhar; Aleti, Aldeida; Cai, Haipeng; Chatzigeorgiou, Alexander; He, Pinjia; Hu, Xing; Pezzè, Mauro; Poshyvanyk, Denys; Xia, Xin",2025,ACM Transactions on Software Engineering and Methodology,String A
77,Artificial intelligence tools in code quality analysis:A systematic review,"Felix, Taina G. C.; Brito, Jean C. De S.; Da Silva, Jorge A. P.; De Aguiar, Phelipe M. C.; Bezerra, Erick C.",2026,Proceedings of the 2026 18th International Conference on Computer Research and Development,String A
78,Assertion Messages with Large Language Models (LLMs) for Code,"Aljohani, Ahmed; Mollah, Anamul Haque; Do, Hyunsook",2025,Proceedings of the 29th International Conference on Evaluation and Assessment in Software Engineering,String A
79,Assessing ChatGPT’s Code Generation Capabilities with Short vs Long Context Programming Problems,"Shuvo, Uddip Acharjee; Dip, Sajib Acharjee; Vaskar, Nirvar Roy; Al Islam, A. B. M. Alim",2024,"Proceedings of the 11th International Conference on Networking, Systems, and Security",String A
80,Assessing and Advancing Benchmarks for Evaluating Large Language Models in Software Engineering Tasks,"Hu, Xing; Niu, Feifei; Chen, Junkai; Zhou, Xin; Zhang, Junwei; He, Junda; Xia, Xin; Lo, David",2025,ACM Transactions on Software Engineering and Methodology,"String A, String B, String C"
81,Assessing the Robustness of Test Selection Methods for Deep Neural Networks,"Hu, Qiang; Guo, Yuejun; Xie, Xiaofei; Cordy, Maxime; Ma, Wei; Papadakis, Mike; Ma, Lei; Le Traon, Yves",2025,ACM Transactions on Software Engineering and Methodology,String B
82,AutoBench: Automatic Testbench Generation and Evaluation Using LLMs for HDL Design,"Qiu, Ruidi; Zhang, Grace Li; Drechsler, Rolf; Schlichtmann, Ulf; Li, Bing",2024,Proceedings of the 2024 ACM/IEEE International Symposium on Machine Learning for CAD,"String A, String B"
83,AutoCodeRover: Autonomous Program Improvement,"Zhang, Yuntong; Ruan, Haifeng; Fan, Zhiyu; Roychoudhury, Abhik",2024,Proceedings of the 33rd ACM SIGSOFT International Symposium on Software Testing and Analysis,String A
84,AutoConsis: Automatic GUI-driven Data Inconsistency Detection of Mobile Apps,"Hu, Yongxiang; Jin, Hailiang; Wang, Xuan; Gu, Jiazhen; Guo, Shiyu; Chen, Chaoyi; Wang, Xin; Zhou, Yangfan",2024,Proceedings of the 46th International Conference on Software Engineering: Software Engineering in Practice,String A
85,AutoTestForge: A Multidimensional Automated Testing Framework for Natural Language Processing Models,"Xing, Hengrui; Tian, Cong; Zhao, Liang; Ma, Zhi; Wang, Wensheng; Zhang, Nan; Huang, Chao; Duan, Zhenhua",2025,ACM Transactions on Software Engineering and Methodology,String A
86,Automated Assessment in Computer Science Education: A State-of-the-Art Review,"Paiva, José Carlos; Leal, José Paulo; Figueira, Álvaro",2022,ACM Transactions on Computing Education,String B
87,Automated Discovery of Test Oracles for Database Management Systems Using LLMs,"Mang, Qiuyang; He, Runyuan; Zhong, Suyang; Liu, Xiaoxuan; Zhang, Huanchen; Cheung, Alvin",2026,Proceedings of the ACM on Management of Data,"String A, String B, String C"
88,Automated Fairness Testing with Representative Sampling,"Karakas, Umutcan; Tosun, Ayse",2023,Proceedings of the 19th International Conference on Predictive Models and Data Analytics in Software Engineering,String A
89,Automated Generation and Compilation of Fuzz Driver Based on Large Language Models,"Sun, Yuxuan",2024,Proceedings of the 2024 9th International Conference on Cyber Security and Information Engineering,String A
90,Automated Generation of Code Contracts: Generative AI to the Rescue?,"Greiner, Sandra; Bühlmann, Noah; Ohrndorf, Manuel; Tsigkanos, Christos; Nierstrasz, Oscar; Kehrer, Timo",2024,Proceedings of the 23rd ACM SIGPLAN International Conference on Generative Programming: Concepts and Experiences,String A
91,Automated Grading and Feedback Tools for Programming Education: A Systematic Review,"Messer, Marcus; Brown, Neil C. C.; Kölling, Michael; Shi, Miaojing",2024,ACM Transactions on Computing Education,String B
92,Automated Model-Based Fuzzing for 5G O-RAN,"Tan, Sixu; Li, Zeyu; Liu, Zhutian; Patel, Harsh; Tan, Zhaowei",2025,Proceedings of the 31st Annual International Conference on Mobile Computing and Networking,"String A, String B, String C"
93,Automated Program Repair via Conversation: Fixing 162 out of 337 Bugs for $0.42 Each using ChatGPT,"Xia, Chunqiu Steven; Zhang, Lingming",2024,Proceedings of the 33rd ACM SIGSOFT International Symposium on Software Testing and Analysis,String A
94,Automated Prompt Engineering for Cost-Effective Code Generation Using Evolutionary Algorithms,"Taherkhani, Hamed; Sepidband, Melika; Pham, Hung Viet; Wang, Song; Hemmati, Hadi",2026,ACM Transactions on Software Engineering and Methodology,"String A, String B"
95,Automated Test Generation for Medical Rules Web Services: A Case Study at the Cancer Registry of Norway,"Laaber, Christoph; Yue, Tao; Ali, Shaukat; Schwitalla, Thomas; Nygård, Jan F.",2023,Proceedings of the 31st ACM Joint European Software Engineering Conference and Symposium on the Foundations of Software Engineering,"String A, String B"
96,Automated Testing Linguistic Capabilities of NLP Models,"Lee, Jaeseong; Chen, Simin; Mordahl, Austin; Liu, Cong; Yang, Wei; Wei, Shiyi",2024,ACM Transactions on Software Engineering and Methodology,"String A, String B"
97,Automated Testing of COBOL to Java Transformation,"Hans, Sandeep; Kumar, Atul; Yasue, Toshiaki; Ono, Kouichi; Krishnan, Saravanan; Sondhi, Devika; Satoh, Fumiko; Mitchell, Gerald; Kumar, Sachin; Saha, Diptikalyan",2025,Proceedings of the 33rd ACM International Conference on the Foundations of Software Engineering,"String A, String B, String C"
98,Automated Unit Test Generation via Chain-of-Thought Prompt and Reinforcement Learning from Coverage Feedback,"Zhang, Junwei; Hu, Xing; Xia, Xin; Cheung, Shing-Chi; Li, Shanping",2026,ACM Transactions on Software Engineering and Methodology,"String A, String B, String C"
99,Automated Unit Test Improvement using Large Language Models at Meta,"Alshahwan, Nadia; Chheda, Jubin; Finogenova, Anastasia; Gokkaya, Beliz; Harman, Mark; Harper, Inna; Marginean, Alexandru; Sengupta, Shubho; Wang, Eddy",2024,Companion Proceedings of the 32nd ACM International Conference on the Foundations of Software Engineering,String B
100,Automated Unit Test Refactoring,"Gao, Yi; Hu, Xing; Yang, Xiaohu; Xia, Xin",2025,Proceedings of the ACM on Software Engineering,"String A, String B, String C"
101,Automated Validation of COBOL to Java Transformation,"Kumar, Atul; Saha, Diptikalyan; Yasue, Toshiaki; Ono, Kohichi; Krishnan, Saravanan; Hans, Sandeep; Satoh, Fumiko; Mitchell, Gerald; Kumar, Sachin",2024,Proceedings of the 39th IEEE/ACM International Conference on Automated Software Engineering,"String A, String B, String C"
