id,title,authors,year,venue,search_strings
102,Automatic Generation of Test Cases based on Bug Reports: a Feasibility Study with Large Language Models,"Plein, Laura; Ouédraogo, Wendkûuni C.; Klein, Jacques; Bissyandé, Tegawendé F.",2024,Proceedings of the 2024 IEEE/ACM 46th International Conference on Software Engineering: Companion Proceedings,String A
103,Automatic Library Migration Using Large Language Models: First Results,"Almeida, Aylton; Xavier, Laerte; Valente, Marco Tulio",2024,Proceedings of the 18th ACM/IEEE International Symposium on Empirical Software Engineering and Measurement,String A
104,Automatic Programming: Large Language Models and Beyond,"Lyu, Michael R.; Ray, Baishakhi; Roychoudhury, Abhik; Tan, Shin Hwei; Thongtanunam, Patanamon",2025,ACM Transactions on Software Engineering and Methodology,String A
105,Automatic Repair of Quantum Programs via Unitary Operation,"Li, Yuechen; Pei, Hanyu; Huang, Linzhi; Yin, Beibei; Cai, Kai-Yuan",2024,ACM Transactions on Software Engineering and Methodology,String B
106,Automatic Semantic Augmentation of Language Model Prompts (for Code Summarization),"Ahmed, Toufique; Pai, Kunal Suresh; Devanbu, Premkumar; Barr, Earl",2024,Proceedings of the IEEE/ACM 46th International Conference on Software Engineering,String A
107,Automatic Test Case Generation for Jasper App HDL Compiler: An Industry Experience,"Crepalde, Mirlaine; Mafra, Augusto; Cavalini, Lucas; Martins, Lucas; Amorim, Guilherme; Santos, Pedro Henrique; Peixoto, Fabiano",2025,Proceedings of the 34th ACM SIGPLAN International Conference on Compiler Construction,String A
108,Automatically Engineering Trusted Software: A Research Roadmap,"Brun, Yuriy; Chakraborty, Saikat; Le Goues, Claire; Păsăreanu, Corina; Singla, Adish",2026,ACM Transactions on Software Engineering and Methodology,"String A, String B"
109,Automatically Inspecting Thousands of Static Bug Warnings with Large Language Model: How Far Are We?,"Wen, Cheng; Cai, Yuandao; Zhang, Bin; Su, Jie; Xu, Zhiwu; Liu, Dugang; Qin, Shengchao; Ming, Zhong; Cong, Tian",2024,ACM Transactions on Knowledge Discovery from Data,"String A, String B"
110,Automatically Learning a Precise Measurement for Fault Diagnosis Capability of Test Cases,"Zhao, Yifan; Sun, Zeyu; Wang, Guoqing; Liang, Qingyuan; Zhang, Yakun; Lou, Yiling; Hao, Dan; Zhang, Lu",2025,ACM Transactions on Software Engineering and Methodology,"String A, String B"
111,Automatically Recommend Code Updates: Are We There Yet?,"Liu, Yue; Tantithamthavorn, Chakkrit; Liu, Yonghui; Thongtanunam, Patanamon; Li, Li",2024,ACM Transactions on Software Engineering and Methodology,String A
112,Autonomous and Adaptive Systems,"Li, J.; Zhang, M.; Li, N.; Weyns, D.; Jin, Z.; Tei, K.; Di Nitto, E.; Gerostathopoulos, I.; Bellman, K.; Metzger, A.",2024,ACM Transactions on,String A
113,B4: Towards Optimal Assessment of Plausible Code Solutions with Plausible Tests,"Chen, Mouxiang; Liu, Zhongxin; Tao, He; Hong, Yusu; Lo, David; Xia, Xin; Sun, Jianling",2024,Proceedings of the 39th IEEE/ACM International Conference on Automated Software Engineering,"String A, String B"
114,Battling against Protocol Fuzzing: Protecting Networked Embedded Devices from Dynamic Fuzzers,"Liu, Puzhuo; Zheng, Yaowen; Sun, Chengnian; Li, Hong; Li, Zhi; Sun, Limin",2024,ACM Transactions on Software Engineering and Methodology,"String A, String B"
115,Benchmarking Automated Program Repair: An Extensive Study on Both Real-World and Artificial Bugs,"Ouyang, Yicheng; Yang, Jun; Zhang, Lingming",2024,Proceedings of the 33rd ACM SIGSOFT International Symposium on Software Testing and Analysis,String B
116,Benchmarking LLMs for Unit Test Generation from Real-World Functions,"Huang, Dong; Zhang, Jie M.; Harman, Mark; Zhang, Qianru; Du, Mingzhe; Ng, See-Kiong",2026,ACM Transactions on Software Engineering and Methodology,"String A, String B, String C"
117,Beyond Coverage: Automatic Test Suite Augmentation for Enhanced Effectiveness using Large Language Models,"Lu, Zeyu; Zhang, Peng; Nie, Yuge; Yang, Yibiao; Tang, Yutian; Chong, Chun Yong; Zhou, Yuming",2026,Proceedings of the ACM on Programming Languages,"String A, String B, String C"
118,Beyond Functional Correctness: A Knowledge-Enhanced Iterative Framework for Generating Criteria-Compliant Code,"Zhang, Yating; Dong, Wei; Wang, Shangwen; Zhang, Jing; Zhang, Siyu; Liu, Jiaxin",2026,ACM Transactions on Software Engineering and Methodology,String A
119,Beyond Functional Correctness: Investigating Coding Style Inconsistencies in Large Language Models,"Wang, Yanlin; Jiang, Tianyue; Liu, Mingwei; Chen, Jiachi; Mao, Mingzhi; Liu, Xilin; Ma, Yuchi; Zheng, Zibin",2025,Proceedings of the ACM on Software Engineering,String A
120,Beyond Static Pattern Matching? Rethinking Automatic Cryptographic API Misuse Detection in the Era of LLMs,"Xia, Yifan; Xie, Zichen; Liu, Peiyu; Lu, Kangjie; Liu, Yan; Wang, Wenhai; Ji, Shouling",2025,Proceedings of the ACM on Software Engineering,"String A, String B"
121,Beyond Words: On Large Language Models Actionability in Mission-Critical Risk Analysis,"Esposito, Matteo; Palagiano, Francesco; Lenarduzzi, Valentina; Taibi, Davide",2024,Proceedings of the 18th ACM/IEEE International Symposium on Empirical Software Engineering and Measurement,String A
122,Beyond the Benefits: A Systematic Review of the Harms and Consequences of Generative AI in Computing Education,"Bernstein, Seth; Rahman, Ashfin; Sharifi, Nadia; Terbish, Ariunjargal; MacNeil, Stephen",2025,Proceedings of the 25th Koli Calling International Conference on Computing Education Research,String A
123,Bias Testing and Mitigation in LLM-based Code Generation,"Huang, Dong; M. Zhang, Jie; Bu, Qingwen; Xie, Xiaofei; Chen, Junjie; Cui, Heming",2026,ACM Transactions on Software Engineering and Methodology,String A
124,Blended Analysis for Predictive Execution,"Li, Yi; Dhulipala, Hridya; Yadavally, Aashish; Rong, Xiaokai; Wang, Shaohua; Nguyen, Tien N.",2025,Proceedings of the ACM on Software Engineering,String B
125,Blockchain Smart Contract Security: Threats and Mitigation Strategies in a Lifecycle Perspective,"Liu, Detian; Zhang, Jianbiao; Wang, Yifan; Shen, Hong; Zhang, Zhaoqian; Ye, Tao",2026,ACM Computing Surveys,String B
126,Booster: Effective and Efficient Web GUI Trace Reduction Based on Multi-Level State Abstraction and Time-Guided Hierarchical Delta Debugging,"Liu, Chenxu; Wang, Junheng; Song, Zihe; Yang, Wei; Zhang, Ying; Xie, Tao",2026,ACM Transactions on Software Engineering and Methodology,String B
127,Boosting Program Reduction with the Missing Piece of Syntax-Guided Transformations,"Xu, Zhenyang; Tian, Yongqiang; Zhang, Mengxiao; Sun, Chengnian",2025,Proceedings of the ACM on Programming Languages,String A
128,Breaking the Silence: the Threats of Using LLMs in Software Engineering,"Sallou, June; Durieux, Thomas; Panichella, Annibale",2024,Proceedings of the 2024 ACM/IEEE 44th International Conference on Software Engineering: New Ideas and Emerging Results,"String A, String B, String C"
129,Brevity is the Soul of Wit: Condensing Code Changes to Improve Commit Message Generation,"Kuang, Hongyu; Zhang, Ning; Gao, Hui; Zhou, Xin; Assuncao, Wesley K. G.; Ma, Xiaoxing; Shao, Dong; Rong, Guoping; Zhang, He",2025,Proceedings of the 16th International Conference on Internetware,String A
130,Bridging Gaps in LLM Code Translation: Reducing Errors with Call Graphs and Bridged Debuggers,"Luo, Yang; Yu, Richard; Zhang, Fajun; Liang, Ling; Xiong, Yongqiang",2024,Proceedings of the 39th IEEE/ACM International Conference on Automated Software Engineering,String A
131,Bringing Invariant Analysis to modern IDEs: The DIG+ Extension for VS Code,"Piciorea, Stefania; Nguyen, ThanhVu",2025,Proceedings of the 34th ACM SIGSOFT International Symposium on Software Testing and Analysis,"String A, String B"
132,BugSpotter: Automated Generation of Code Debugging Exercises,"P?durean, Victor-Alexandru; Denny, Paul; Singla, Adish",2025,Proceedings of the 56th ACM Technical Symposium on Computer Science Education V. 1,String A
133,CATCODER: Repository-Level Code Generation with Relevant Code and Type Context,"Pan, Zhiyuan; Hu, Xing; Xia, Xin; Yang, Xiaohu",2025,ACM Transactions on Software Engineering and Methodology,String A
134,CCCI: Code Completion with Contextual Information for Complex Data Transfer Tasks Using Large Language Models,"Jin, Hangzhan; Hamdaqa, Mohammad",2025,Proceedings of the 29th International Conference on Evaluation and Assessment in Software Engineering,String A
135,CI/CD Configuration Practices in Open Source Android Apps: An Empirical Study,"Ghaleb, Taher A.; Abduljalil, Osamah; Hassan, Safwat",2026,ACM Transactions on Software Engineering and Methodology,"String A, String B"
136,CMakeSonar: A Static Approach to Detecting CMake Bugs with a Fine-Grained Type System,"Han, Haotian; Zhong, Zihang; Li, Qingan; Xue, Jingling; Yuan, Mengting",2026,Proceedings of the ACM on Programming Languages,String A
137,COFFE: A Code Efficiency Benchmark for Code Generation,"Peng, Yun; Wan, Jun; Li, Yichen; Ren, Xiaoxue",2025,Proceedings of the ACM on Software Engineering,String A
138,COSTELLO: Contrastive Testing for Embedding-Based Large Language Model as a Service Embeddings,"Jiang, Weipeng; Zhai, Juan; Ma, Shiqing; Zhang, Xiaoyu; Shen, Chao",2024,Proceedings of the ACM on Software Engineering,String B
139,CRISPE: Semantic-Guided Execution Planning and Dynamic Reasoning for Enhancing Code Coverage Prediction,"Dhulipala, Hridya; Yadavally, Aashish; Patel, Smit Soneshbhai; Nguyen, Tien N.",2025,Proceedings of the ACM on Software Engineering,"String A, String B, String C"
140,Can LLMs Replace Human Evaluators? An Empirical Study of LLM-as-a-Judge in Software Engineering,"Wang, Ruiqi; Guo, Jiyu; Gao, Cuiyun; Fan, Guodong; Chong, Chun Yong; Xia, Xin",2025,Proceedings of the ACM on Software Engineering,String A
141,Can Large Language Models Transform Natural Language Intent into Formal Method Postconditions?,"Endres, Madeline; Fakhoury, Sarah; Chakraborty, Saikat; Lahiri, Shuvendu K.",2024,Proceedings of the ACM on Software Engineering,"String A, String B"
142,Causality-Aided Evaluation and Explanation of Large Language Model-Based Code Generation,"Ji, Zhenlan; Ma, Pingchuan; Li, Zongjie; Wang, Zhaoyu; Wang, Shuai",2025,Proceedings of the ACM on Software Engineering,String A
143,Causality-Driven Test Case Minimisation for Cyber-Physical Systems,"Foster, Michael; Poskitt, Christopher M.; Latimer, Nicholas R.; Walkinshaw, Neil; Somers, Richard; Hierons, Robert M.",2026,ACM Transactions on Software Engineering and Methodology,"String A, String B"
144,Chain of Targeted Verification Questions to Improve the Reliability of Code Generated by LLMs,"Kouemo Ngassom, Sylvain; Moradi Dakhel, Arghavan; Tambon, Florian; Khomh, Foutse",2024,Proceedings of the 1st ACM International Conference on AI-Powered Software,String B
145,ChangeGuard: Validating Code Changes via Pairwise Learning-Guided Execution,"Gröninger, Lars; Souza, Beatriz; Pradel, Michael",2025,Proceedings of the ACM on Software Engineering,String A
146,ChatDBG: Augmenting Debugging with Large Language Models,"Levin, Kyla H.; Van Kempen, Nicolas; Berger, Emery D.; Freund, Stephen N.",2025,Proceedings of the ACM on Software Engineering,String B
147,ChatUniTest: A Framework for LLM-Based Test Generation,"Chen, Yinghao; Hu, Zehao; Zhi, Chen; Han, Junxiao; Deng, Shuiguang; Yin, Jianwei",2024,Companion Proceedings of the 32nd ACM International Conference on the Foundations of Software Engineering,String A
148,ClarifyGPT: A Framework for Enhancing LLM-Based Code Generation via Requirements Clarification,"Mu, Fangwen; Shi, Lin; Wang, Song; Yu, Zhuohao; Zhang, Binquan; Wang, ChenXue; Liu, Shichao; Wang, Qing",2024,Proceedings of the ACM on Software Engineering,String A
149,"Clean Code, Better Models: Enhancing LLM Performance with Smell-Cleaned Dataset","Xue, Zhipeng; Zhang, Xiaoting; Gao, Zhipeng; Hu, Xing; Gao, Shan; Xia, Xin; Li, Shanping",2026,ACM Transactions on Software Engineering and Methodology,String A
150,"CoEdPilot: Recommending Code Edits with Learned Prior Edit Relevance, Project-wise Awareness, and Interactive Nature","Liu, Chenyan; Cai, Yufan; Lin, Yun; Huang, Yuhuan; Pei, Yunrui; Jiang, Bo; Yang, Ping; Dong, Jin Song; Mei, Hong",2024,Proceedings of the 33rd ACM SIGSOFT International Symposium on Software Testing and Analysis,String A
151,Code LLMs Still Fall Short of Top Programmers: Evaluating Algorithmic Code Generation Through Computational Thinking,"Chen, Shisong; Zhou, Ziyu; Zhao, Yicong; Yang, Chengyi; Li, Zhixu; Xiao, Yanghua; Lin, Xin; Meng, Xiaojun; Wei, Jiansheng; Liu, Kuien",2026,Proceedings of the Nineteenth ACM International Conference on Web Search and Data Mining,String A
152,Code on Demand: A Comparative Analysis of the Efficiency Understandability and Self-Correction Capability of Copilot ChatGPT and Gemini,"Batista, Samuel Silvestre; Branco, Bruno; Castro, Otávio; Avelino, Guilherme",2024,Proceedings of the XXIII Brazilian Symposium on Software Quality,String A
153,Code-Aware Prompting: A Study of Coverage-Guided Test Generation in Regression Setting using LLM,"Ryan, Gabriel; Jain, Siddhartha; Shang, Mingyue; Wang, Shiqi; Ma, Xiaofei; Ramanathan, Murali Krishna; Ray, Baishakhi",2024,Proceedings of the ACM on Software Engineering,"String A, String B, String C"
154,CodeEduBench: A Multidimensional Benchmark for Evaluating AI-Driven Code Generation Models in C Programming Education,"Zhou, Yi; Shan, Zhenyu; Dai, Zeyao; Zhang, Zhao",2025,Proceedings of the 2025 International Conference on Artificial Intelligence and Educational Systems,String A
155,CodeFuse-13B: A Pretrained Multi-lingual Code Large Language Model,"Di, Peng; Li, Jianguo; Yu, Hang; Jiang, Wei; Cai, Wenting; Cao, Yang; Chen, Chaoyu; Chen, Dajun; Chen, Hongwei; Chen, Liang; Fan, Gang; Gong, Jie; Gong, Zi; Hu, Wen; Guo, Tingting; Lei, Zhichao; Li, Ting; Li, Zheng; Liang, Ming; Liao, Cong; Liu, Bingchang; Liu, Jiachen; Liu, Zhiwei; Lu, Shaojun; Shen, Min; Wang, Guangpei; Wang, Huan; Wang, Zhi; Xu, Zhaogui; Yang, Jiawei; Ye, Qing; Zhang, Gehao; Zhang, Yu; Zhao, Zelin; Zheng, Xunjin; Zhou, Hailian; Zhu, Lifu; Zhu, Xianying",2024,Proceedings of the 46th International Conference on Software Engineering: Software Engineering in Practice,String A
156,CodeS: Natural Language to Code Repository via Multi-Layer Sketch,"Zan, Daoguang; Yu, Ailun; Liu, Wei; Chen, Dong; Shen, Bo; Yao, Yafen; Li, Wei; Chen, Xiaolin; Gong, Yongshun; Guan, Bei; Yang, Zhiguang; Wang, Yongji; Cui, Lizhen; Wang, Qianxiang",2025,ACM Transactions on Software Engineering and Methodology,String A
157,Codellm-Devkit: A Framework for Contextualizing Code LLMs with Program Analysis Insights,"Krishna, Rahul; Pan, Rangeet; Sinha, Saurabh; Tamilselvam, Srikanth; Pavuluri, Raju; Vukovic, Maja",2025,Proceedings of the 33rd ACM International Conference on the Foundations of Software Engineering,String A
158,CoderUJB: An Executable and Unified Java Benchmark for Practical Programming Scenarios,"Zeng, Zhengran; Wang, Yidong; Xie, Rui; Ye, Wei; Zhang, Shikun",2024,Proceedings of the 33rd ACM SIGSOFT International Symposium on Software Testing and Analysis,String A
159,Collaborative LLM Agents for End-to-End Software Development,"Garg, Shweta; Omidvar-Tehrani, Behrooz; Fu, Shengyu; Guinet, Gauthier; Ray, Baishakhi",2026,Companion Proceedings of the ACM Web Conference 2026,String A
160,Combating Missed Recalls in E-commerce Search: A CoT-Prompting Testing Approach,"Wu, Shengnan; Hu, Yongxiang; Wang, Yingchuan; Gu, Jiazhen; Meng, Jin; Fan, Liujie; Luan, Zhongshi; Wang, Xin; Zhou, Yangfan",2024,Companion Proceedings of the 32nd ACM International Conference on the Foundations of Software Engineering,String A
161,Comparative Analysis of Large Language Models for Context-Aware Code Completion using SAFIM Framework,"Zhang, Hang; Shen, Yanxin; Wang, Lun; Shi, Chuanqi; Du, Shaoshuai; Tao, Yiyi; Shen, Yixian",2025,Proceedings of the 2025 International Conference on Artificial Intelligence and Computational Intelligence,String A
162,Compiler.next: A Search-Based Compiler to Power the AI-Native Future of Software Engineering,"Cogo, Filipe R.; Oliva, Gustavo A.; Hassan, Ahmed E.",2026,ACM Transactions on Software Engineering and Methodology,String A
163,ComplexCodeEval: A Benchmark for Evaluating Large Code Models on More Complex Code,"Feng, Jia; Liu, Jiachen; Gao, Cuiyun; Chong, Chun Yong; Wang, Chaozheng; Gao, Shan; Xia, Xin",2024,Proceedings of the 39th IEEE/ACM International Conference on Automated Software Engineering,String A
164,ConDefects: A Complementary Dataset to Address the Data Leakage Concern for LLM-Based Fault Localization and Program Repair,"Wu, Yonghao; Li, Zheng; Zhang, Jie M.; Liu, Yong",2024,Companion Proceedings of the 32nd ACM International Conference on the Foundations of Software Engineering,String B
165,CoverFL: Enhancing Fault Localization via Deep Coverage Relation,"Chen, Wei; Liu, Jiamou; Zhao, Kaiqi; Zhang, Mingyue; Chen, Wu",2026,ACM Transactions on Software Engineering and Methodology,String B
166,CoverUp: Effective High Coverage Test Generation for Python,"Altmayer Pizzorno, Juan; Berger, Emery D.",2025,Proceedings of the ACM on Software Engineering,"String A, String B, String C"
167,Coverage-based Strategies for the Automated Synthesis of Test Scenarios for Conversational Agents,"Canizares, Pablo C.; Ávila, Daniel; Perez-Soler, Sara; Guerra, Esther; De Lara, Juan",2024,Proceedings of the 5th ACM/IEEE International Conference on Automation of Software Test (AST 2024),"String A, String B"
168,CrossProbe: LLM-Empowered Cross-Project Bug Detection for Deep Learning Frameworks,"Guan, Hao; Bai, Guangdong; Liu, Yepang",2025,Proceedings of the ACM on Software Engineering,"String A, String B"
169,Curiosity-Driven Testing for Sequential Decision-Making Process,"He, Junda; Yang, Zhou; Shi, Jieke; Yang, Chengran; Kim, Kisub; Xu, Bowen; Zhou, Xin; Lo, David",2024,Proceedings of the IEEE/ACM 46th International Conference on Software Engineering,String B
170,DAInfer: Inferring API Aliasing Specifications from Library Documentation via Neurosymbolic Optimization,"Wang, Chengpeng; Zhang, Jipeng; Wu, Rongxin; Zhang, Charles",2024,Proceedings of the ACM on Software Engineering,String A
171,DSCode Comparator: An Interactive Interface for Comparing Models and Evaluating Code for Data Science Tasks,"Yu, Xinxin; Zhong, Victor; Crisan, Anamaria",2026,Proceedings of the 31st International Conference on Intelligent User Interfaces,String A
172,Dark and Bright Side of Participatory Red-Teaming with Targets of Stereotyping for Eliciting Harmful Behaviors from Large Language Models,"Kim, Sieun; Jo, Yeeun; Na, Sungmin; Lim, Hyunseung; Lee, Eunchae; Choi, Yu Min; Cho, Soohyun; Hong, Hwajung",2026,Proceedings of the 2026 CHI Conference on Human Factors in Computing Systems,String A
173,Data-Prompt Co-Evolution: Growing Test Sets to Refine LLM Behavior,"Lee, Minjae; Kahng, Minsuk",2026,Proceedings of the 2026 CHI Conference on Human Factors in Computing Systems,String A
174,DataSpeck: An AI-Driven Human-in-the-Loop System for Automating Transformations in Data Conversion Workflows,"Rahman, Adil; Niinuma, Koichiro; Gupta, Aakar",2026,Proceedings of the 2026 CHI Conference on Human Factors in Computing Systems,String A
175,De-duplicating Silent Compiler Bugs via Deep Semantic Representation,"Chen, Junjie; Fan, Xingyu; Yang, Chen; Liu, Shuang; Sun, Jun",2025,Proceedings of the ACM on Software Engineering,String B
176,"Deep Learning Library Testing: Definition, Methods and Challenges","Zhang, Xiaoyu; Jiang, Weipeng; Shen, Chao; Li, Qi; Wang, Qian; Lin, Chenhao; Guan, Xiaohong",2025,ACM Computing Surveys,"String A, String B"
177,DeepREST: Automated Test Case Generation for REST APIs Exploiting Deep Reinforcement Learning,"Corradini, Davide; Montolli, Zeno; Pasqua, Michele; Ceccato, Mariano",2024,Proceedings of the 39th IEEE/ACM International Conference on Automated Software Engineering,"String A, String B, String C"
178,Demystifying LLM-Based Software Engineering Agents,"Xia, Chunqiu Steven; Deng, Yinlin; Dunn, Soren; Zhang, Lingming",2025,Proceedings of the ACM on Software Engineering,"String A, String B"
179,Demystifying React Native Android Apps for Static Analysis,"Liu, Yonghui; Chen, Xiao; Liu, Pei; Samhi, Jordan; Grundy, John; Chen, Chunyang; Li, Li",2025,ACM Transactions on Software Engineering and Methodology,"String A, String B"
180,Demystifying and Detecting Misuses of Deep Learning APIs,"Wei, Moshi; Harzevili, Nima Shiri; Huang, Yuekai; Yang, Jinqiu; Wang, Junjie; Wang, Song",2024,Proceedings of the IEEE/ACM 46th International Conference on Software Engineering,String A
181,DepFuzz: Efficient Smart Contract Fuzzing with Function Dependence Guidance,"Ma, Chenyang; Song, Wei; Huang, Jeff",2025,Proceedings of the ACM on Programming Languages,"String A, String B"
182,Designing PairBuddy—A Conversational Agent for Pair Programming,"Robe, Peter; Kuttal, Sandeep Kaur",2022,ACM Transactions on Computer-Human Interaction,"String A, String B"
183,Detecting Code Smells using ChatGPT: Initial Insights,"Silva, Luciana Lourdes; Silva, Janio Rosa Da; Montandon, Joao Eduardo; Andrade, Marcus; Valente, Marco Tulio",2024,Proceedings of the 18th ACM/IEEE International Symposium on Empirical Software Engineering and Measurement,String A
184,"Detecting, Creating, Repairing, and Understanding Indivisible Multi-Hunk Bugs","Xin, Qi; Wu, Haojun; Tang, Jinran; Liu, Xinyu; Reiss, Steven P.; Xuan, Jifeng",2024,Proceedings of the ACM on Software Engineering,String A
185,Developing Critical Thinking with AI Coding Assistants: An Educational Experience focusing on Testing and Legacy Code,"Blasquez, Isabelle",2025,Proceedings of the 30th ACM Conference on Innovation and Technology in Computer Science Education V. 1,String A
186,Development and Utilization of AI-Enabled Automatic Programming Problem Generator Using the CodeRunner Plugin of Moodle,"Serato, Jay Vince Donoso; Sta. Romana, Cherry Lyn",2024,Proceedings of the 2024 10th International Conference on Education and Training Technologies,String A
187,DiaVio: LLM-Empowered Diagnosis of Safety Violations in ADS Simulation Testing,"Lu, You; Tian, Yifan; Bi, Yuyang; Chen, Bihuan; Peng, Xin",2024,Proceedings of the 33rd ACM SIGSOFT International Symposium on Software Testing and Analysis,String A
188,Directed Real-time Linux Fuzzing with Configuration Awareness,"Shen, Yuheng; Liu, Jianzhong; Chen, Yuhan; Zhang, Qiang; Wang, Runzhe; Shi, Heyuan; Jiang, Yu",2025,ACM Transactions on Embedded Computing Systems,"String A, String B, String C"
189,DivLog: Log Parsing with Prompt Enhanced In-Context Learning,"Xu, Junjielong; Yang, Ruichun; Huo, Yintong; Zhang, Chengyu; He, Pinjia",2024,Proceedings of the IEEE/ACM 46th International Conference on Software Engineering,"String A, String B"
190,Do Automatic Comment Generation Techniques Fall Short? Exploring the Influence of Method Dependencies on Code Understanding,"Billah, Md Mustakim; Rahman, Md Shamimur; Roy, Banani",2025,Proceedings of the 29th International Conference on Evaluation and Assessment in Software Engineering,String A
191,Doc2OracLL: Investigating the Impact of Documentation on LLM-Based Test Oracle Generation,"Hossain, Soneya Binta; Taylor, Raygan; Dwyer, Matthew",2025,Proceedings of the ACM on Software Engineering,String A
192,Does Every Computer Scientist Need to Know Formal Methods?,"Broy, Manfred; Brucker, Achim D.; Fantechi, Alessandro; Gleirscher, Mario; Havelund, Klaus; Kuppe, Markus Alexander; Mendes, Alexandra; Platzer, André; Ringert, Jan Oliver; Sullivan, Allison",2025,Formal Aspects of Computing,String A
193,Domain Adaptation for Code Model-Based Unit Test Case Generation,"Shin, Jiho; Hashtroudi, Sepehr; Hemmati, Hadi; Wang, Song",2024,Proceedings of the 33rd ACM SIGSOFT International Symposium on Software Testing and Analysis,"String A, String B, String C"
194,Drowzee: Metamorphic Testing for Fact-Conflicting Hallucination Detection in Large Language Models,"Li, Ningke; Li, Yuekang; Liu, Yi; Shi, Ling; Wang, Kailong; Wang, Haoyu",2024,Proceedings of the ACM on Programming Languages,String A
195,EPSC: Testing Database Management Systems via Equivalent Prepared Statement Construction,"Zhang, Chi; Liang, Jie; Wu, Zhiyong; Shi, Dalong; Wang, Linzhang; Jiang, Yu",2026,Proceedings of the ACM on Management of Data,String A
196,EffFix: Efficient and Effective Repair of Pointer Manipulating Programs,"Zhang, Yuntong; Costea, Andreea; Shariffdeen, Ridwan; McCall, Davin; Roychoudhury, Abhik",2025,ACM Transactions on Software Engineering and Methodology,String B
197,Effective On-Hardware Fuzzing of Embedded Operating Systems,"Shen, Yuheng; Liu, Jianzhong; Guo, Qiming; Chu, Yifei; Zhang, Qiang; Shi, Heyuan; Jiang, Yu",2026,Proceedings of the 21st European Conference on Computer Systems,String B
198,"Effective, Platform-Independent GUI Testing via Image Embedding and Reinforcement Learning","Yu, Shengcheng; Fang, Chunrong; Li, Xin; Ling, Yuchen; Chen, Zhenyu; Su, Zhendong",2024,ACM Transactions on Software Engineering and Methodology,String B
199,Efficient Directed Hybrid Fuzzing via Target-Centric Seed Selection and Generation,"Li, Zhen; Liu, Shenghan; Yi, Qiuping; Du, Pengbo; Liang, Hongliang",2026,Proceedings of the ACM on Programming Languages,"String A, String B"
200,"Efficient and Green Large Language Models for Software Engineering: Literature Review, Vision, and the Road Ahead","Shi, Jieke; Yang, Zhou; Lo, David",2025,ACM Transactions on Software Engineering and Methodology,"String A, String B"
201,Efficient and Robust Security-Patch Localization for Disclosed OSS Vulnerabilities with Fine-Tuned LLMs in an Industrial Setting,"Ran, Dezhi; Li, Lin; Zhu, Liuchuan; Cao, Yuan; Zhao, Landelong; Tan, Xin; Liang, Guangtai; Wang, Qianxiang; Xie, Tao",2025,Proceedings of the 33rd ACM International Conference on the Foundations of Software Engineering,String A
