id,title,authors,year,venue,search_strings
202,Emerging Compiler Testing Based on Test Case Reuse,"Zhu, Kelin; Wang, Yu; Wang, Linzhang; Li, Xuandong",2025,Proceedings of the 16th International Conference on Internetware,"String A, String B, String C"
203,Enabling Cost-Effective UI Automation Testing with Retrieval-Based LLMs: A Case Study in WeChat,"Feng, Sidong; Lu, Haochuan; Jiang, Jianqin; Xiong, Ting; Huang, Likun; Liang, Yinglin; Li, Xiaoqin; Deng, Yuetang; Aleti, Aldeida",2024,Proceedings of the 39th IEEE/ACM International Conference on Automated Software Engineering,String A
204,Engaging Developers in Exploratory Unit Testing through Gamification,"Straubinger, Philipp; Fraser, Gordon",2024,"Proceedings of the 3rd ACM International Workshop on Gamification in Software Development, Verification, and Validation","String A, String B"
205,Enhanced Web Testing with LLMs: A Research Roadmap,"Wang, Weizhe; Guo, Zhenqi; Yan, Qingyang; Yang, Zenghao; Zhang, Yao; Xu, Guangquan; Li, Xiaoming; Wu, Bin",2026,ACM Transactions on Software Engineering and Methodology,"String A, String B"
206,Enhancing APR with PRISM: A Semantic-Based Approach to Overfitting Patch Detection,"Song, Dowon; Oh, Hakjoo",2025,Proceedings of the ACM on Programming Languages,"String A, String B"
207,Enhancing Automated Unit Test Generation with Large Language Models: A Systematic Literature Review,"Zhang, Junwei; Hu, Xing; Gao, Cuiyun; Xia, Xin; Li, Shanping",2026,ACM Transactions on Software Engineering and Methodology,"String A, String B, String C"
208,Enhancing Differential Testing with LLMs for Testing Deep Learning Libraries,"Li, Meiziniu; Li, Dongze; Liu, Jianmeng; Cao, Jialun; Tian, Yongqiang; Cheung, Shing-Chi",2026,ACM Transactions on Software Engineering and Methodology,String B
209,Enhancing Human-IDE Interaction in the SDLC using LLM-based Mediator Agents,"Li, Ziyou; Izadi, Maliheh",2025,Proceedings of the 33rd ACM International Conference on the Foundations of Software Engineering,String B
210,Enhancing REST API Testing with NLP Techniques,"Kim, Myeongsoo; Corradini, Davide; Sinha, Saurabh; Orso, Alessandro; Pasqua, Michele; Tzoref-Brill, Rachel; Ceccato, Mariano",2023,Proceedings of the 32nd ACM SIGSOFT International Symposium on Software Testing and Analysis,"String A, String B, String C"
211,Enhancing Web Accessibility: Automated Detection of Issues with Generative AI,"He, Ziyao; Huq, Syed Fatiul; Malek, Sam",2025,Proceedings of the ACM on Software Engineering,String B
212,Enhancing the Efficiency of Automated Program Repair via Greybox Analysis,"Kim, YoungJae; Park, Yechan; Han, Seungheon; Yi, Jooyong",2024,Proceedings of the 39th IEEE/ACM International Conference on Automated Software Engineering,"String A, String B, String C"
213,Enhancing the Resiliency of Automated Web Tests with Natural Language,"Ayli, Maroun; Bakouny, Youssef; Jalloul, Nader; Kilany, Rima",2024,"Proceedings of the 2024 4th International Conference on Artificial Intelligence, Automation and Algorithms",String A
214,Evaluating API-Level Deep Learning Fuzzers: A Comprehensive Benchmarking Study,"Harzevili, Nima Shiri; Wei, Moshi; Mohajer, Mohammad Mahdi; Pham, Hung Viet; Wang, Song",2026,ACM Transactions on Software Engineering and Methodology,"String A, String B, String C"
215,Evaluating Capabilities and Perspectives of Generative AI Tools in Smart Contract Development,"Khalid, Shawal; Brown, Chris",2025,Proceedings of the 7th ACM International Symposium on Blockchain and Secure Critical Infrastructure,String B
216,Evaluating LLM-based Agents for Multi-turn Conversations: A Survey,"Guan, Shengyue; Wang, Jindong; Bian, Jiang; Zhu, Bin; Lou, Jian-Guang; Xiong, Haoyi",2026,ACM Transactions on Intelligent Systems and Technology,String A
217,Evaluating Large Language Models in Class-Level Code Generation,"Du, Xueying; Liu, Mingwei; Wang, Kaixin; Wang, Hanlin; Liu, Junwei; Chen, Yixuan; Feng, Jiayi; Sha, Chaofeng; Peng, Xin; Lou, Yiling",2024,Proceedings of the IEEE/ACM 46th International Conference on Software Engineering,"String A, String B"
218,Evaluating and Improving ChatGPT for Unit Test Generation,"Yuan, Zhiqiang; Liu, Mingwei; Ding, Shiji; Wang, Kaixin; Chen, Yixuan; Peng, Xin; Lou, Yiling",2024,Proceedings of the ACM on Software Engineering,"String A, String B, String C"
219,Evaluating the Complex Reasoning and Performance Capabilities of Large Language Models for Test Case Generation: A Learning-Based Software Testing Suite for Benchmarking Generative AI in Automated Test Case Generation,"Bala Mahalingam, Vijay; Parthasarathy, Harish; Baskaran, Aakash; Chandrasekaran, Bharath; Rajeshkumar, Muthukrishnan",2026,Proceedings of the 2026 10th International Conference on Control Engineering and Artificial Intelligence,"String A, String B, String C"
220,Evaluating the Ethical Judgment of Large Language Models in Financial Market Abuse Cases,"Pandey, Avinash Kumar; Rajwal, Swati",2025,Proceedings of the 6th ACM International Conference on AI in Finance,String A
221,Evaluation of Automatic Test Case Generation for the Android Operating System using Deep Reinforcement Learning,"Cardoso, Ana Paula; Santos, Cleicy Priscilla; Collins, Eliane; Lima, Kelen; Quiroga, Pablo; Griego, Marlon",2023,Proceedings of the XXII Brazilian Symposium on Software Quality,String A
222,Ever-Improving Test Suite by Leveraging Large Language Models,"Qiu, Ketai",2025,Proceedings of the 33rd ACM International Conference on the Foundations of Software Engineering,String A
223,Every Maintenance Has Its Exemplar: The Future of Software Maintenance through Migration,"Chen, Zirui; Hu, Xing; Xia, Xin; Yang, Xiaohu",2026,ACM Transactions on Software Engineering and Methodology,String A
224,EvoCLINICAL: Evolving Cyber-Cyber Digital Twin with Active Transfer Learning for Automated Cancer Registry System,"Lu, Chengjie; Xu, Qinghua; Yue, Tao; Ali, Shaukat; Schwitalla, Thomas; Nygård, Jan F.",2023,Proceedings of the 31st ACM Joint European Software Engineering Conference and Symposium on the Foundations of Software Engineering,String A
225,Evolving Enactions of Expertise: Software Engineers’ Evaluation and Demonstration of Coding Expertise with AI Coding Assistants,"Jang, Yeonju; Sakashita, Mose; Niinuma, Koichiro; Gupta, Aakar",2026,Proceedings of the 2026 CHI Conference on Human Factors in Computing Systems,String A
226,"Evolving Paradigms in Automated Program Repair: Taxonomy, Challenges, and Opportunities","Huang, Kai; Xu, Zhengzi; Yang, Su; Sun, Hongyu; Li, Xuejun; Yan, Zheng; Zhang, Yuqing",2025,ACM Computing Surveys,"String A, String B"
227,Examining the Use and Impact of an AI Code Assistant on Developer Productivity and Experience in the Enterprise,"Weisz, Justin D.; Kumar, Shraddha Vijay; Muller, Michael; Browne, Karen-Ellen; Goldberg, Arielle; Heintze, Katrin Ellice; Bajpai, Shagun",2025,Proceedings of the Extended Abstracts of the CHI Conference on Human Factors in Computing Systems,String A
228,Examples out of Thin Air: AI-Generated Dynamic Context to Assist Program Comprehension by Example,"Mattis, Toni; Krebs, Eva; Rinard, Martin C.; Hirschfeld, Robert",2024,"Companion Proceedings of the 8th International Conference on the Art, Science, and Engineering of Programming",String A
229,Exploring Automated Assertion Generation via Large Language Models,"Zhang, Quanjun; Sun, Weifeng; Fang, Chunrong; Yu, Bowen; Li, Hongyan; Yan, Meng; Zhou, Jianyi; Chen, Zhenyu",2025,ACM Transactions on Software Engineering and Methodology,String A
230,Exploring Code Analysis: Zero-Shot Insights on Syntax and Semantics with LLMs,"Ma, Wei; Lin, Zhihao; Liu, Shangqing; Hu, Qiang; Liu, Ye; Wang, Wenhan; Zhang, Cen; Nie, Liming; Li, Li; Liu, Yang; Jiang, Lingxiao",2026,ACM Transactions on Software Engineering and Methodology,String B
231,Exploring Large Language Models in Resolving Environment-Related Crash Bugs: Localizing and Repairing,"Du, Xueying; Liu, Mingwei; Wang, Hanlin; Li, Juntao; Peng, Xin; Lou, Yiling",2026,ACM Transactions on Software Engineering and Methodology,String A
232,Exploring and Unleashing the Power of Large Language Models in Automated Code Translation,"Yang, Zhen; Liu, Fang; Yu, Zhongxing; Keung, Jacky Wai; Li, Jia; Liu, Shuo; Hong, Yifan; Ma, Xiaoxue; Jin, Zhi; Li, Ge",2024,Proceedings of the ACM on Software Engineering,"String A, String B, String C"
233,Extraction and Mutation at a High Level: Template-Based Fuzzing for JavaScript Engines,"Wong, Wai Kin; Xiao, Dongwei; Lai, Cheuk Tung; Peng, Yiteng; Wu, Daoyuan; Wang, Shuai",2025,Proceedings of the ACM on Programming Languages,String A
234,FAIL: Analyzing Software Failures from the News Using LLMs,"Anandayuvaraj, Dharun; Campbell, Matthew; Tewari, Arav; Davis, James C",2024,Proceedings of the 39th IEEE/ACM International Conference on Automated Software Engineering,String B
235,FURINA: A Multi-Agent Framework for Automated Patch Correctness Assessment,"Li, Yuning; Ji, Yuanjie; Chen, Xiang; Shen, Zongwen; Ge, Jidong; Luo, Bin",2026,ACM Transactions on Software Engineering and Methodology,String A
236,Face: A framework for ai-driven coding generation evaluation,"Ngo, Bao; Formato, Jack; May, James J.; Ho, Nguyen; Bui, Hoang; Ngo, Linh B.",2024,Journal of Computing Sciences in Colleges,String B
237,Fairness Testing: A Comprehensive Survey and Analysis of Trends,"Chen, Zhenpeng; Zhang, Jie M.; Hort, Max; Harman, Mark; Sarro, Federica",2024,ACM Transactions on Software Engineering and Methodology,String A
238,Fault Localization from the Semantic Code Search Perspective,"Qin, Yihao; Wang, Shangwen; Lei, Yan; Zhang, Zhuo; Lin, Bo; Peng, Xin; Ma, Jun; Chen, Liqian; Mao, Xiaoguang",2026,ACM Transactions on Software Engineering and Methodology,String B
239,Finding Missed Code Size Optimizations in Compilers using Large Language Models,"Italiano, Davide; Cummins, Chris",2025,Proceedings of the 34th ACM SIGPLAN International Conference on Compiler Construction,"String A, String B"
240,Finding and Investigating Buggy Codes to Make CS1 Learning Efficient,"Agarwal, Nimisha",2024,Proceedings of the 17th Innovations in Software Engineering Conference,String A
241,Flowco: Mixed-Initiative Authoring of Reliable End-to-End Data Analyses via Dataflow Graphs and LLMs,"Freund, Stephen N.; Simon, Brooke; Berger, Emery D.; Jun, Eunice",2025,Proceedings of the 38th Annual ACM Symposium on User Interface Software and Technology,String A
242,FreeWavm: Enhanced WebAssembly Runtime Fuzzing Guided by Parse Tree Mutation and Snapshot,"Qian, Peng; Ying, Xinlei; Wang, Jiashui; Liu, Long; Zhang, Lun; Chen, Jianhai; He, Qinming",2025,Proceedings of the ACM on Software Engineering,String B
243,From Black Box to Learning Artifact: A Proposed Pedagogical Redesign of AI Coding Assistants for Novice Programmers,"Prasad, Prajish; Sane, Aamod; Chitkulwar, Shivkiran",2026,Proceedings of the Extended Abstracts of the 2026 CHI Conference on Human Factors in Computing Systems,String A
244,From Correctness to Code Quality: Formalizing Software Engineering Metrics for Evaluating General LLMs,"Umre, Jayesh; Parihar, Ashish Singh; Gupta, Atul",2026,Proceedings of the 19th Innovations in Software Engineering Conference,String A
245,From Fine-tuning to Output: An Empirical Investigation of Test Smells in Transformer-Based Test Code Generation,"Aljohani, Ahmed; Do, Hyunsook",2024,Proceedings of the 39th ACM/SIGAPP Symposium on Applied Computing,"String A, String B"
246,From Legal Text to Tech Specs: Generative AI’s Interpretation of Consent in Privacy Law,"Kesari, Aniket; Breaux, Travis; Santos, Sarah; Norton, Tom; Singhal, Anmol",2025,Proceedings of the Twentieth International Conference on Artificial Intelligence and Law,String A
247,From Prompts to Properties: Rethinking LLM Code Generation with Property-Based Testing,"Bose, Dibyendu Brinto",2025,Proceedings of the 33rd ACM International Conference on the Foundations of Software Engineering,"String A, String B"
248,From Prompts to Templates: A Systematic Prompt Template Analysis for Real-world LLMapps,"Mao, Yuetian; He, Junjie; Chen, Chunyang",2025,Proceedings of the 33rd ACM International Conference on the Foundations of Software Engineering,String A
249,From Scenario to Code: Structured Prompting for LLM-Based Unit Test Generation,"Diop, Aminata; Toure, Fadel; Badri, Mourad",2025,Proceedings of the 2025 7th World Symposium on Software Engineering,"String A, String B, String C"
250,From Stochastic to Semantic: Advanced Attribute-Guided Compiler Testing,"Wu, Jiangchang; Yang, Yibiao; Sun, Maolin; Li, Qingyang; Chen, Kang; Xu, Lei; Zhou, Yuming",2026,ACM Transactions on Software Engineering and Methodology,String B
251,From Today’s Code to Tomorrow’s Symphony: The AI Transformation of Developer’s Routine by 2030,"Qiu, Ketai; Puccinelli, Niccolò; Ciniselli, Matteo; Di Grazia, Luca",2025,ACM Transactions on Software Engineering and Methodology,"String A, String B"
252,From Triumph to Uncertainty: The Journey of Software Engineering in the AI Era,"Mastropaolo, Antonio; Escobar-Velásquez, Camilo; Linares-Vásquez, Mario",2025,ACM Transactions on Software Engineering and Methodology,String A
253,Fuzz Testing for Polymorphic Network Firmware: A Collaborative Optimization Framework of LLMs and Neural Networks,"Qian, Ben; Gu, Yunjie; Wu, Changhe; Mu, Yuan; Sun, Xuan",2025,Proceedings of the ACM Conext-2025 Workshop on the Polymorphic Network,"String A, String B, String C"
254,Fuzz4All: Universal Fuzzing with Large Language Models,"Xia, Chunqiu Steven; Paltenghi, Matteo; Le Tian, Jia; Pradel, Michael; Zhang, Lingming",2024,Proceedings of the IEEE/ACM 46th International Conference on Software Engineering,"String A, String B"
255,Fuzzing C++ Compilers via Type-Driven Mutation,"Wang, Bo; Chen, Chong; Deng, Ming; Chen, Junjie; Zhang, Xing; Lin, Youfang; Hao, Dan; Sun, Jun",2025,Proceedings of the ACM on Programming Languages,String B
256,Fuzzing JavaScript Interpreters with Coverage-Guided Reinforcement Learning for LLM-Based Mutation,"Eom, Jueon; Jeong, Seyeon; Kwon, Taekyoung",2024,Proceedings of the 33rd ACM SIGSOFT International Symposium on Software Testing and Analysis,String B
257,Fuzzing Microservices in Face of Intrinsic Uncertainties,"Zhang, Man; Yue, Tao; Arcuri, Andrea",2026,ACM Transactions on Software Engineering and Methodology,"String A, String B"
258,Fuzzing for Stateful Protocol Programs Based on Constraints between States and Message Types,"Jian, Kunpeng; Zou, Yanyan; Li, Menghao; Huo, Wei",2025,Proceedings of the 16th International Conference on Internetware,String B
259,GUI Test Migration via Abstraction and Concretization,"Zhang, Yakun; Liu, Chen; Xie, Xiaofei; Lin, Yun; Dong, Jin Song; Hao, Dan; Zhang, Lu",2026,ACM Transactions on Software Engineering and Methodology,"String A, String B, String C"
260,Generating Software Tests for Mobile Applications Using Fine-Tuned Large Language Models,"Hoffmann, Jacob; Frister, Demian",2024,Proceedings of the 5th ACM/IEEE International Conference on Automation of Software Test (AST 2024),String B
261,Generative AI for Self-Adaptive Systems: State of the Art and Research Roadmap,"Li, Jialong; Zhang, Mingyue; Li, Nianyu; Weyns, Danny; Jin, Zhi; Tei, Kenji",2024,ACM Transactions on Autonomous and Adaptive Systems,String A
262,GenieWizard: Multimodal App Feature Discovery with Large Language Models,"Yang, Jackie (Junrui); Shi, Yingtian; Gu, Chris; Zheng, Zhang; Jain, Anisha; Li, Tianshi; Lam, Monica S.; Landay, James A.",2025,Proceedings of the 2025 CHI Conference on Human Factors in Computing Systems,String A
263,Grey-Box Fuzzing in Constrained Ultra-Large Systems: Lessons for SE Community,"Yu, Jiazhao; Tu, Yanlun; Zhang, Zhanlei; Zhang, Tiehua; Xu, Cheng; Wu, Weigang; Kang, Hong Jin; Zheng, Xi",2025,Proceedings of the 33rd ACM International Conference on the Foundations of Software Engineering,"String A, String B, String C"
264,GrowthHacker: Automated Off-Policy Evaluation Optimization Using Code-Modifying LLM Agents,"Wu, Jie Jw; Herlihy, Ayanda Patrick; Mirza, Ahmad Saleem; Afoud, Ali; Fard, Fatemeh",2026,ACM Transactions on Software Engineering and Methodology,String B
265,GuardRails: Automated Suggestions for Clarifying Ambiguous Purpose Statements,"Pawagi, Mrigank; Kumar, Viraj",2023,Proceedings of the 16th Annual ACM India Compute Conference,String B
266,HITS: High-coverage LLM-based Unit Test Generation via Method Slicing,"Wang, Zejun; Liu, Kaibo; Li, Ge; Jin, Zhi",2024,Proceedings of the 39th IEEE/ACM International Conference on Automated Software Engineering,"String A, String B, String C"
267,Hallucination to Consensus: Multi-Agent LLMs for End-to-End JUnit Test Generation,"Xu, Qinghua; Wang, Guancheng; Briand, Lionel; Liu, Kui",2026,ACM Transactions on Software Engineering and Methodology,"String A, String B, String C"
268,Harden and Catch for Just-in-Time Assured LLM-Based Software Testing: Open Research Challenges,"Harman, Mark; O'Hearn, Peter; Sengupta, Shubho",2025,Proceedings of the 33rd ACM International Conference on the Foundations of Software Engineering,"String A, String B, String C"
269,History-Driven Fuzzing for Deep Learning Libraries,"Shiri Harzevili, Nima; Mohajer, Mohammad Mahdi; Wei, Moshi; Pham, Hung Viet; Wang, Song",2025,ACM Transactions on Software Engineering and Methodology,"String A, String B"
270,How Beginning Programmers and Code LLMs (Mis)read Each Other,"Nguyen, Sydney; Babe, Hannah McLean; Zi, Yangtian; Guha, Arjun; Anderson, Carolyn Jane; Feldman, Molly Q",2024,Proceedings of the CHI Conference on Human Factors in Computing Systems,String B
271,How Do Analysts Understand and Verify AI-Assisted Data Analyses?,"Gu, Ken; Shang, Ruoxi; Althoff, Tim; Wang, Chenglong; Drucker, Steven M.",2024,Proceedings of the CHI Conference on Human Factors in Computing Systems,String A
272,How Does Simulation-Based Testing for Self-Driving Cars Match Human Perception?,"Birchler, Christian; Mohammed, Tanzil Kombarabettu; Rani, Pooja; Nechita, Teodora; Kehrer, Timo; Panichella, Sebastiano",2024,Proceedings of the ACM on Software Engineering,String B
273,How Execution Features Relate to Failures: An Empirical Study and Diagnosis Approach,"Smytzek, Marius; Eberlein, Martin; Grunske, Lars; Zeller, Andreas",2025,ACM Transactions on Software Engineering and Methodology,String B
274,How Multi-Modal LLMs Reshape Visual Deep Learning Testing? A Comprehensive Study Through the Lens of Image Mutation,"Wang, Liwen; Yuan, Yuanyuan; Sun, Ao; Li, Zongjie; Ma, Pingchuan; Wu, Daoyuan; Wang, Shuai",2026,ACM Transactions on Software Engineering and Methodology,String B
275,How Scientists Use Large Language Models to Program,"O'Brien, Gabrielle",2025,Proceedings of the 2025 CHI Conference on Human Factors in Computing Systems,String A
276,How far have we been on the path of LLM-enhanced vulnerability detection,"Shen, Wuqiang; Yang, Yi; Zhang, Xiaolu; Cui, Lei; Wang, Yechao",2025,Proceedings of the 2025 International Symposium on Artificial Intelligence and Computational Social Sciences,String B
277,Human-AI Collaboration in Software Engineering: Lessons Learned from a Hands-On Workshop,"Hamza, Muhammad; Siemon, Dominik; Akbar, Muhammad Azeem; Rahman, Tahsinur",2024,Proceedings of the 7th ACM/IEEE International Workshop on Software-intensive Business,String A
278,HumanEval-V: Systematic Evaluation of Visual Reasoning in Large Multimodal Models for Code Generation,"Zhang, Fengji; Wu, Linquan; Bai, Huiyu; Lin, Guancheng; Li, Xiao; Yu, Xiao; Wang, Yue; Chen, Bei; Keung, Jacky",2026,ACM Transactions on Software Engineering and Methodology,String B
279,HumanEvalComm: Benchmarking the Communication Competence of Code Generation for LLMs and LLM Agents,"Wu, Jie Jw; Fard, Fatemeh H.",2025,ACM Transactions on Software Engineering and Methodology,"String A, String B"
280,Hybrid Automated Program Repair by Combining Large Language Models and Program Analysis,"Li, Fengjie; Jiang, Jiajun; Sun, Jiajun; Zhang, Hongyu",2025,ACM Transactions on Software Engineering and Methodology,String A
281,ICAM-Trans: Implicit-Context-Aware Multi-Agent Framework for Function-Level Code Translation,"Chen, Ruolin; Wang, Jiexin; Cao, Liuwen; Cai, Yi; Zhao, Mengchen",2026,ACM Transactions on Software Engineering and Methodology,String A
282,"If At First You Don’t Succeed, Try, Try, Again...? Insights and LLM-informed Tooling for Detecting Retry Bugs in Software Systems","Stoica, Bogdan Alexandru; Sethi, Utsav; Su, Yiming; Zhou, Cyrus; Lu, Shan; Mace, Jonathan; Musuvathi, Madanlal; Nath, Suman",2024,Proceedings of the ACM SIGOPS 30th Symposium on Operating Systems Principles,String B
283,Improved Program Repair Methods using Refactoring with GPT Models,"Ishizue, Ryosuke; Sakamoto, Kazunori; Washizaki, Hironori; Fukazawa, Yoshiaki",2024,Proceedings of the 55th ACM Technical Symposium on Computer Science Education V. 1,String A
284,Improving Deep Assertion Generation via Fine-Tuning Retrieval-Augmented Pre-Trained Language Models,"Zhang, Quanjun; Fang, Chunrong; Zheng, Yi; Zhang, Yaxin; Zhao, Yuan; Huang, Rubing; Zhou, Jianyi; Yang, Yun; Zheng, Tao; Chen, Zhenyu",2025,ACM Transactions on Software Engineering and Methodology,"String A, String B"
285,Improving FIM Code Completions via Context & Curriculum Based Learning,"Sagtani, Hitesh; Mehrotra, Rishabh; Liu, Beyang",2025,Proceedings of the Eighteenth ACM International Conference on Web Search and Data Mining,String A
286,In-Context Learning as an Effective Estimator of Functional Correctness of LLM-Generated Code,"Das, Susmita; Ghosh, Madhusudan; Swami, Priyanka; Ganguly, Debasis; Calikli, Gul",2025,Proceedings of the 48th International ACM SIGIR Conference on Research and Development in Information Retrieval,String A
287,Increasing Test Coverage by Automating BDD Tests in Proofs of Concepts (POCs) using LLM,"Santos, Shexmo Richarlison Ribeiro Dos; Fernandes, Raiane Eunice S.; Santos, Marcos Cesar Barbosa Dos; Soares, Michel S.; Rocha, Fabio Gomes; Marczak, Sabrina",2024,Proceedings of the XXIII Brazilian Symposium on Software Quality,"String A, String B, String C"
288,Individualized Quizzes From Student Code with LLMs,"Novak, Ed; McDanel, Bradley",2026,Proceedings of the 57th ACM Technical Symposium on Computer Science Education V.2,String A
289,"Integrating LLMs in Software Engineering Education: Motivators, Demotivators, and a Roadmap Towards a Framework for Finnish Higher Education Institutes","Khan, Maryam; Akbar, Muhammad Azeem; Kasurinen, Jussi",2025,Proceedings of the 2025 29th International Conference on Evaluation and Assessment in Software Engineering Companion,String A
290,Interleaving Large Language Models for Compiler Testing,"Ni, Yunbo; Li, Shaohua",2025,Proceedings of the ACM on Programming Languages,String B
291,Investigating Documented Privacy Changes in Android OS,"Yan, Chuan; Meng, Mark Huasong; Xie, Fuman; Bai, Guangdong",2024,Proceedings of the ACM on Software Engineering,String A
292,JavaBench: A Benchmark of Object-Oriented Code Generation for Evaluating Large Language Models,"Cao, Jialun; Chen, Zhiyong; Wu, Jiarong; Cheung, Shing-Chi; Xu, Chang",2024,Proceedings of the 39th IEEE/ACM International Conference on Automated Software Engineering,"String A, String B"
293,Just-In-Time Quality Assurance with Assistance of Automated Defect Prediction and Code Testing,"Tian, Dawei; Song, Liyan; Su, Xiaohong",2026,ACM Transactions on Software Engineering and Methodology,"String A, String B, String C"
294,Kitten: A Simple Yet Effective Baseline for Evaluating LLM-Based Compiler Testing Techniques,"Xie, Yuanmin; Xu, Zhenyang; Tian, Yongqiang; Zhou, Min; Zhou, Xintong; Sun, Chengnian",2025,Proceedings of the 34th ACM SIGSOFT International Symposium on Software Testing and Analysis,String B
295,Knowledge Transfer from High-Resource to Low-Resource Programming Languages for Code LLMs,"Cassano, Federico; Gouwar, John; Lucchetti, Francesca; Schlesinger, Claire; Freeman, Anders; Anderson, Carolyn Jane; Feldman, Molly Q; Greenberg, Michael; Jangda, Abhinav; Guha, Arjun",2024,Proceedings of the ACM on Programming Languages,"String A, String B"
296,LDMDroid: Leveraging LLMs for Detecting Data Manipulation Errors in Android Apps,"Xiao, Xiangyang; Huang, Huaxun; Wu, Rongxin",2026,ACM Transactions on Software Engineering and Methodology,String B
297,LEAM++: Learning for Selective Mutation Fault Construction,"Tian, Zhao; Chen, Junjie; Wang, Dong; Zhu, Qihao; Fan, Xingyu; Zhang, Lingming",2025,ACM Transactions on Software Engineering and Methodology,String B
298,LIReDroid: LLM-Enhanced Test Case Generation for Static Sensitive Behavior Replication,"Wang, Yin; Fan, Ming; Zhang, Xicheng; Shi, Jifei; Qiu, Zhaoyu; Wang, Haijun; Liu, Ting",2024,Proceedings of the 15th Asia-Pacific Symposium on Internetware,String A
299,LLM for Mobile: An Initial Roadmap,"Chen, Daihang; Liu, Yonghui; Zhou, Mingyi; Zhao, Yanjie; Wang, Haoyu; Wang, Shuai; Chen, Xiao; Bissyandé, Tegawendé F.; Klein, Jacques; Li, Li",2025,ACM Transactions on Software Engineering and Methodology,String A
300,LLM-Based Code Generation Method for Golang Compiler Testing,"Gu, Qiuhan",2023,Proceedings of the 31st ACM Joint European Software Engineering Conference and Symposium on the Foundations of Software Engineering,String B
301,LLM-Based Misconfiguration Detection for AWS Serverless Computing,"Wen, Jinfeng; Chen, Zhenpeng; Zhu, Zixi; Sarro, Federica; Liu, Yi; Ping, Haodi; Wang, Shangguang",2026,ACM Transactions on Software Engineering and Methodology,String A
302,LLM-CompDroid: Repairing Configuration Compatibility Bugs in Android Apps with Pre-trained Large Language Models,"Liu, Zhijie; Tang, Yutian; Li, Meiyun; Jin, Xin; Long, Yunfei; Zhang, Liang Feng; Luo, Xiapu",2026,ACM Transactions on Software Engineering and Methodology,String A
